id,name,email,gender,skills
1,Berty Androck,bandrock0@hexun.com,Male,"UIUX, Business, Database, sql, QC Business, CSS Data, Database"
2,Gun Halligan,ghalligan1@nbcnews.com,Male,"AWS, Golang Java, English C++, Management Business, MS TFS, Leader"
3,Arnold Boggas,aboggas2@de.vu,Male,"Jupyter Notebook, QC Business, SQL, JavaScript NodeJS, Scrum Database, Linux"
4,Clerkclaude Gilpillan,cgilpillan3@comcast.net,Male,"Cloud Cloud, Cloud Java, SQL Database, Data Analyst, Product, Android 2D AutoCAD"
5,Donovan le Keux,dle4@delicious.com,Male,"Python, MySQL, General IT Management, Agile, Csharp, Database"
6,Tann Scamwell,tscamwell5@amazon.com,Male,"NodeJS, Project, Blockchain, Team, Html, Python"
7,Nev Conneely,nconneely6@sphinn.com,Male,"qlickview Microsof Office, Django Python, Cloud Database, English, Designing And Devevoping Websites By Writing Html, English"
8,Klarrisa Eykelbosch,keykelbosch7@ezinearticles.com,Female,"QC Business, Microsoft Powerpoint. RECOGNITION Academic Secured First place in B.Tech.   AI, Asp Programming With Access Db, Project, Database, Illustrutor"
9,Justus Veazey,jveazey8@github.io,Male,"Python, English Business, Data Analyst, Python, C C++, Cloud Cloud"
10,Brose Haack,bhaack9@oracle.com,Male,"MySQL Database, Laravel, Python, Golang Java, OOP, Database"
11,Andy George,ageorgea@un.org,Female,"Programming in-Python, Management, Database, Android 2D AutoCAD, Programmining Using Visual Basic Language, C# .NET 4.0"
12,Ferrell Blaszczyk,fblaszczykb@nbcnews.com,Male,"Rails, PostgreSql NodeJS, Designer C++, Data Analyst, Test Case/Matrix Development, Debian-Kali Linux    IOT"
13,Barde Dacca,bdaccac@wunderground.com,Male,"Data Analyst, UIUX, Business, Linux, Management Business, Remote Executing Commands On Systems"
14,Judd Kitchin,jkitchind@adobe.com,Male,"Scrum Database, MySQL, Management, DevOps NodeJS, Data Analyst, NodeJS"
15,Teodor Moseley,tmoseleye@google.co.uk,Male,"Data Analyst, Data Analyst, MySQL, Networking C++, Robotics  Reports, Designing And Devevoping Websites By Writing Html"
16,Nessie Gladebeck,ngladebeckf@ucoz.com,Female,"AWS Java, Golang Java, Database, Business, SQL Python, Database"
17,Vittorio Berntssen,vberntsseng@tinyurl.com,Male,"Python, .NET PHP, Test Results Analysis Microsoft Access With Sql, Ubuntu, Test CAse Execusion, English"
18,Elnora McGaraghan,emcgaraghanh@fastcompany.com,Female,"3D  AutoCAD  Database, Leader SQL, Python, sql, Management, sql"
19,Marcela Kevane,mkevanei@discovery.com,Female,"Agile, SQL Database, HTML, SQL Python, Python, NodeJS"
20,Anders Farthing,afarthingj@java.com,Male,"I have more than 3 years experience developing websites and also in graphic degsing, Data Analyst, Laravel, Data Analyst, QC Business, Database"
21,Valeda Robertsen,vrobertsenk@tmall.com,Female,"Jquery, Project Management Skills, Database, English, English C++, Angular PHP"
22,Ham Scouller,hscoullerl@prweb.com,Male,"NodeJS, Database Business, C++, DotNet Development It Support, NoSQL Java, Data Analyst Business"
23,Bonni Teligin,bteliginm@blogspot.com,Non-binary,"Project, Honours Degree Psychology, on, ReactJS Python, Python3, AWS Java"
24,Norris Betonia,nbetonian@joomla.org,Male,"MySQL, SQL Java, SQL, System, Project, Java"
25,Goddard Bassom,gbassomo@youtu.be,Male,"project management, Programmining Using Visual Basic Language, Linux, Agile, QA, Python"
26,Loralie Bene,lbenep@amazon.de,Female,"SQL Python, on, Asp Programming With Access Db, Database Business, people management, Leader"
27,Bill Wardrope,bwardropeq@indiegogo.com,Male,"Python, MS Exchange Server, Python, 3D  AutoCAD  Database, Data, MySQL"
28,Johny Hoffner,jhoffnerr@tuttocitta.it,Male,"PHP NodeJS, Business, Java IDE-Eclipse Operating Systems Windows, Spring NodeJS, Sql Server Photoshop, on"
29,Vina Aspinall,vaspinalls@wikia.com,Female,"Management, Cloud, AWS, Database, System, Business"
30,Trueman Bouts,tboutst@naver.com,Male,"powerpoint, Team, Sql Server Photoshop, OOP, Database, English"
31,Briney Bosman,bbosmanu@dot.gov,Female,"Analytics, Data Analyst, Data Analyst, Data Analyst, on, ireport"
32,Cob Beatty,cbeattyv@imageshack.us,Male,"DevOps NodeJS, Product, MySQL, Xampp, Data, AWS Ruby"
33,Osbert Carolan,ocarolanw@dyndns.org,Male,"Golang Team, NodeJS, SQL SQL, Cloud Database, MySQL Database, Database"
34,Hermine Kerrich,hkerrichx@rediff.com,Female,"Laravel PHP, Networking C++, Python Software Packages Interpreters-Anaconda, Agile Business, QC Business, Team"
35,Randee Boyack,rboyacky@livejournal.com,Female,"Python, Project, SQL, UIUX, Business, Management Database, NodeJS Python"
36,Haley Dysert,hdysertz@biglobe.ne.jp,Female,"SQL Python, I have more than 3 years experience developing websites and also in graphic degsing, JavaScript, Database, Data Analyst Business, Data Analyst"
37,Aldous Gerson,agerson10@hatena.ne.jp,Male,"MySQL, on, i can build online stores and also promote websites using google adwords, MATLAB, Data Analyst Business, MS TFS"
38,Chelsae Lecointe,clecointe11@weebly.com,Female,"Leader, MSSQL, Csharp, SQL, General IT Management, SQL Database"
39,Elsey Dionisetti,edionisetti12@is.gd,Female,"English Business, Rails, Engineering, JavaScript, Database, Html"
40,Loy Tuting,ltuting13@gizmodo.com,Male,"Golang Java, English Business, English, Java IDE-Eclipse Operating Systems Windows, Asp Programming With Access Db, Python"
41,Ermin Bassam,ebassam14@amazon.de,Male,"English Business, Microsoft Word, Data Analyst, ASP.NET Tester, AWS PHP, Data Analyst"
42,Chickie Crowley,ccrowley15@nba.com,Female,"Python3, JavaScript, SQL Business, i can work on deadlines Business Development, MS TFS, MySQL"
43,Gilda Fontin,gfontin16@booking.com,Female,"Product, JavaScript, SQL Database, Asp Programming With Access Db, Python Software Packages Interpreters-Anaconda, Data Analyst"
44,Kit Tesmond,ktesmond17@joomla.org,Male,"Leader SQL, Data Analyst, Test Results Analysis Microsoft Access With Sql, Python, PostgreSqlPsychology Degree, Management Business"
45,Olivero Jaukovic,ojaukovic18@smh.com.au,Male,"Python Software Packages Interpreters-Anaconda, Cloud Cloud, QC Business, Python, SQL Java, project management"
46,Stesha Tomblings,stomblings19@google.it,Female,"project management, Networking C++, indesign, UIUX, Business, Graphic designing, Management"
47,Shelton Durgan,sdurgan1a@boston.com,Male,"Analytics, Management, Python, Jquery, PHP PHP, Cloud PHP"
48,Isabel Youle,iyoule1b@squarespace.com,Female,"Designer C++, OOP, SQL, SQL Database, SQL, CSS Data"
49,Hulda De Carteret,hde1c@t-online.de,Non-binary,"MySQL, PHP PHP, Python, Agile, Project, SQL Business"
50,Jeanna Warriner,jwarriner1d@joomla.org,Female,"AWS Java, QA, Java, SQL, i can work on deadlines Business Development, AWS PHP"
51,Nappy Bennen,nbennen1e@infoseek.co.jp,Male,"Project, HTML, Python, LabView, Java IDE-Eclipse Operating Systems Windows, Management"
52,Karlen Eadmead,keadmead1f@google.com,Female,"PostgreSql, Spring NodeJS, Sql Server Photoshop, Forecasts English, MSSQL, SQL"
53,Janka Ferrolli,jferrolli1g@npr.org,Female,"Data Analyst, QA, Microsoft Support, Rails, ASP.NET Tester, Test Strategy Development"
54,Natty Vince,nvince1h@toplist.cz,Male,"Leader, QC Business, SQL Java, Microsoft Word, C#, Robotics  Reports"
55,Averell Pelosi,apelosi1i@cbc.ca,Male,"Data Analyst, C, Data Analyst, Data Analyst, MySQL, Test Strategy Development"
56,Daren Jeram,djeram1j@cdbaby.com,Male,"Database, Analytics, Python, Management Business, SQL Business, Linux"
57,Alberik Minihan,aminihan1k@washington.edu,Male,"English Business, Database, AWS Ruby, Golang Java, Database, Scala Python"
58,Johan Gretham,jgretham1l@cafepress.com,Male,"Data Analyst, Data Analyst, Golang Python, Data Analyst, NoSQL Java, Data Analyst"
59,Aharon Ellwood,aellwood1m@geocities.jp,Male,"NodeJS, Test Strategy Development, NoSQL Java, English Business, Leader, Spring NodeJS"
60,Waneta Villaron,wvillaron1n@samsung.com,Female,"Pycharm, Angular PHP, Golang Java, Designing And Devevoping Websites By Writing Html, C# .NET 4.0, Data Analyst Business"
61,Freedman Gierok,fgierok1o@webmd.com,Male,"Javascript, i can work on deadlines Business Development, Asp Programming With Access Db, AWS Ruby, MySQL, QC Business"
62,Juanita Baison,jbaison1p@cornell.edu,Female,"MySQL, 3D  AutoCAD  Database, powerbi, Forecasts English, Data Analyst, Database"
63,Bronnie Gwinnell,bgwinnell1q@unblog.fr,Male,"Database, Python, Data Analyst, Data Science, Programmining Using Visual Basic Language, Data Analyst"
64,Kathy Drewitt,kdrewitt1r@unesco.org,Female,"QA, SQL SQL, Java IDE-Eclipse Operating Systems Windows, .NET PHP, Css, MS Exchange Server"
65,Boothe Baiden,bbaiden1s@globo.com,Male,"Programmining Using Visual Basic Language, System, Data Analyst Business, Agile, Data Analyst, Database"
66,Alejoa Dorney,adorney1t@marriott.com,Male,"i can build online stores and also promote websites using google adwords, PostgreSql NodeJS, Designer C++, Test Strategy Development, Microsoft Excel, Database"
67,Devlin Benton,dbenton1u@over-blog.com,Male,"MS Exchange Server, Programming in-Python, Data, PostgreSql NodeJS, Ruby, C# .NET 4.0"
68,Cosmo Brinsford,cbrinsford1v@unesco.org,Bigender,"Financial Managment SQL, Data Analyst, C C++, Python, project management, Forecasts English"
69,Jesse Strowther,jstrowther1w@github.com,Female,"Database, MySQL Database, Data Analyst Business, sql, Database, Ubuntu"
70,Reggie Dennerly,rdennerly1x@jimdo.com,Female,"powerbi, Project, MS Exchange Server, Laravel Python, Data Science, Machine Learning"
71,Leslie De Cleyne,lde1y@gnu.org,Female,"Css, on, English C++, General IT Management, Cloud Java, Sql Server Photoshop"
72,Christoffer Halstead,chalstead1z@yellowpages.com,Male,"Python, Illustrutor, Xampp, Spring NodeJS, SQL Database, System"
73,Cesar Raggles,craggles20@mlb.com,Male,"Data Analyst, Business, MySQL-Basics, C++, English, Angular PHP"
74,Loutitia Philliskirk,lphilliskirk21@skyrock.com,Female,"Python, .NET PHP, Python, I have more than 3 years experience developing websites and also in graphic degsing, Data Analyst, DotNet Development It Support"
75,Suzette Tinson,stinson22@nytimes.com,Female,"Engineering Database, MATLAB, Python, MySQL PHP, powerbi, English"
76,Westbrooke Wainer,wwainer23@weibo.com,Male,"NoSQL NodeJS, JavaScript PHP, PostgreSql Python, English Data, English, Database"
77,Portie Ivashkov,pivashkov24@delicious.com,Male,"Project, Html/Webpage Designing, Data Analyst Business, UIUX, Business, Data Analyst, Html/Webpage Designing"
78,Amandi Giacomelli,agiacomelli25@intel.com,Female,"3D  AutoCAD  Database, General IT Management, Test Plan Development, Cloud Database, Jquery, QA"
79,Zane Buttle,zbuttle26@gravatar.com,Male,"HTML, Analytics, Spring NodeJS, Data Analyst, NoSQL NodeJS"
80,Laraine Silverton,lsilverton27@house.gov,Female,"HP Quality Centre, DevOps NodeJS, MySQL, Leader, Python, English Data"
81,Arabel Bowland,abowland28@hubpages.com,Female,"project management, AWS Ruby, NodeJS Python, Programming in-Python, Data Analyst, JavaScript NodeJS"
82,Sarena Paradise,sparadise29@discuz.net,Polygender,"Python, Agile, Networking Python, Agile, Management, Linux"
83,Micheline Vicarey,mvicarey2a@house.gov,Female,"Database, Scala DevOps, on, MySQL, MS Exchange Server, Pycharm"
84,Shirline Crabtree,scrabtree2b@webeden.co.uk,Female,"SQL Database, Scala Python, Pycharm, Database, project management, Python"
85,Kendre Haythornthwaite,khaythornthwaite2c@squarespace.com,Female,"Microsoft Powerpoint. RECOGNITION Academic Secured First place in B.Tech.   AI, NodeJS Python, AWS Ruby, MySQL, NodeJS, Rails"
86,Demetrius Woffinden,dwoffinden2d@guardian.co.uk,Male,".NET Oracle, Data, Database, Database, Python, Networking C++"
87,Any Isley,aisley2e@free.fr,Male,".NET PHP, Ruby, PostgreSql NodeJS, PostgreSql, SQL Java, Database"
88,Polly Caudell,pcaudell2f@state.gov,Bigender,"Scrum Business, Python2, Data Analyst, SQL Python, QA, Ruby"
89,Eden Fronczak,efronczak2g@samsung.com,Female,"NodeJS, Golang Python, UIUX, Business, Management Business, Database, ASP.NET Tester"
90,Cully Enright,cenright2h@yelp.com,Male,"Database, LabView, Database  Control System Design, Database, Blockchain, Data Analyst"
91,Clim Ivermee,civermee2i@narod.ru,Male,"Jupyter Notebook, C#, Engineering, NodeJS, Laravel Python, Python"
92,Cleveland Doxsey,cdoxsey2j@jalbum.net,Male,"Golang Java, Python, SQL, SQL, Python2, Microsoft Powerpoint. RECOGNITION Academic Secured First place in B.Tech.   AI"
93,Quillan Luckcuck,qluckcuck2k@state.gov,Male,"SQL SQL, SQL Business, C, Python, English Business, SQL Python"
94,Darice Ballinger,dballinger2l@washingtonpost.com,Female,"MySQL, PostgreSqlPsychology Degree, C#, I have more than 3 years experience developing websites and also in graphic degsing, Leader, Database"
95,Vern Couvet,vcouvet2m@google.nl,Male,"English, Data Analyst, Golang Java, English, Team, SQL Business"
96,Carlee Eliasen,celiasen2n@howstuffworks.com,Female,"Database, Database, project management, Agile, Data Analyst, Data Analyst"
97,Bailey Shields,bshields2o@technorati.com,Male,"Python, ASP.NET, Python2, Python, HTML, Networking Python"
98,Karyn Rubinsaft,krubinsaft2p@freewebs.com,Female,"MS Exchange Server, MySQL PHP, Data Analyst, Microsoft Excel, NodeJS Python"
99,Aurore Bonaire,abonaire2q@weebly.com,Female,"Laravel, Forecasts English, HTML5, MSSQL, Xampp, Angular PHP"
100,Devonna Littlecote,dlittlecote2r@tripadvisor.com,Female,"I have more than 3 years experience developing websites and also in graphic degsing, Python, Python, Data Analyst, Python, Python"
101,Rebekkah Kalisch,rkalisch2s@reuters.com,Female,"Product, Data Analyst, MySQL, CSS Data, SQL Tester, MySQL"
102,Celestyn Kennington,ckennington2t@abc.net.au,Female,"QA, i can build online stores and also promote websites using google adwords, ASP.NET Tester, JavaScript, Data Analyst, HP Quality Centre"
103,Leighton Pummery,lpummery2u@springer.com,Male,"Database, people management, System, Python, MySQL, PostgreSql"
104,Lydia Siebert,lsiebert2v@google.ca,Non-binary,"Python, MATLAB, JavaScript PHP, SQL, English Business, SQL"
105,Row Gleadle,rgleadle2w@wired.com,Female,"Test Plan Development, Python, i can work on deadlines Business Development, PostgreSql Python, MySQL, Database Business"
106,Skipton Kobpal,skobpal2x@cdc.gov,Male,"Data Analyst, Test Case/Matrix Development, Agile, Java, Business, Data Science"
107,Estell Curley,ecurley2y@wp.com,Female,"Remote Executing Commands On Systems, Data Analyst, MySQL, Jquery, Agile Business, Leader"
108,Ethelda Ridolfi,eridolfi2z@comsenz.com,Female,"Database, Python, Python, indesign, Data Analyst, on"
109,Elbertina Medeway,emedeway30@google.com.au,Female,"Pycharm, Linux, Management Business, Agile, Management, Python"
110,Alessandro Pulham,apulham31@constantcontact.com,Male,"Data Analyst, Remote Executing Commands On Systems, Illustrutor, Data Analyst, Linux, C#"
111,Corrinne Prigmore,cprigmore32@theguardian.com,Agender,"Data Analyst, Analytics, Data Analyst, Scala Python, Programming in-Python, Android 2D AutoCAD"
112,Radcliffe Sygroves,rsygroves33@csmonitor.com,Male,"MySQL, SQL, MySQL, Database, Data Analyst, Database"
113,Dane Cullingford,dcullingford34@g.co,Male,"Analytics, Flask, HP Quality Centre, SQL Database, Java, Team"
114,Sim Ripping,sripping35@ox.ac.uk,Polygender,"on, QC Business, Business, Data Analyst, Data Analyst, Agile"
115,Jania MacArthur,jmacarthur36@pen.io,Non-binary,"Electric Machinery, Financial Managment SQL, Rails, Python, Laravel Python, HTML"
116,Ward Humphries,whumphries37@dailymotion.com,Male,"Scrum Business, Project, Cloud PHP, Scala Python, General IT Management, i can work on deadlines Business Development"
117,Keefe Corpes,kcorpes38@amazon.com,Male,"SQL Python, PHP, Machine Learning, Linux, Python, JavaScript NodeJS"
118,Ardith Menichillo,amenichillo39@hugedomains.com,Female,"Data Analyst, MySQL, Spring NodeJS, Data Analyst, Jupyter Notebook, Database"
119,Nonie Goodliff,ngoodliff3a@ca.gov,Female,"Cloud, Test Case/Matrix Development, Java, Agile, Python, Database"
120,Tailor Muzzall,tmuzzall3b@edublogs.org,Male,"DotNet Development It Support, CSS Data, Linux, Leader, Python, Laravel"
121,Katleen Bazeley,kbazeley3c@noaa.gov,Female,"Data Analyst, Linux, English Database, Business, MySQL, Electric Machinery"
122,Garner Moggie,gmoggie3d@wordpress.org,Male,"Data Analyst, Java, SQL, C, Database, Data Analyst"
123,Gabriellia Hebbron,ghebbron3e@creativecommons.org,Female,"C#, Forecasts English, Golang Team, AWS, Agile, Debian-Kali Linux    IOT"
124,Lennie Wadly,lwadly3f@1688.com,Male,"Programming in-Python, OOP, Linux, Project, MySQL Database, NodeJS"
125,Alaster Sowten,asowten3g@163.com,Male,"Python, HTML, Microsoft Powerpoint. RECOGNITION Academic Secured First place in B.Tech.   AI, Python, Jupyter Notebook, QA Business"
126,Heath Gosse,hgosse3h@bloglines.com,Male,"Cloud Java, Python, Python, Scala DevOps, Scala Python, CSS Data"
127,Bax Moncreiff,bmoncreiff3i@cargocollective.com,Male,"Leader SQL, Database, i can build online stores and also promote websites using google adwords, MySQL, English, Python"
128,Sigismund Nurse,snurse3j@multiply.com,Male,"Python, Laravel, Microsoft Support, Management Business, SQL, SQL SQL"
129,Zebulon Cogan,zcogan3k@howstuffworks.com,Male,"System, Data Analyst, Agile Business, Java, Java, UIUX, Business"
130,Aundrea Pagel,apagel3l@google.pl,Female,"Test Plan Development, Data Analyst, SQL Business, Golang Python, Data Analyst, Python2"
131,My Staden,mstaden3m@tripadvisor.com,Male,"Ruby, Honours Degree Psychology, PostgreSql Python, powerbi, SQL Java, Data"
132,Bradney Gasticke,bgasticke3n@reverbnation.com,Male,"Data Analyst, Crystal Reports, Visual Basic 6, Linux, Python, powerbi"
133,Hanan Balogun,hbalogun3o@cbslocal.com,Male,"Python, Leader SQL, Leader SQL, NodeJS, Linux, Sql Server Photoshop"
134,Burch Ayars,bayars3p@netlog.com,Male,"Linux, Java, SQL Database, .NET PHP, Remote Executing Commands On Systems, Microsoft Excel"
135,Amalie Baythrop,abaythrop3q@cargocollective.com,Female,"Management Business, Rails, PHP Ruby, SQL Python, i can build online stores and also promote websites using google adwords, Cloud Java"
136,Bastien Westell,bwestell3r@netvibes.com,Male,"SQL Business, project management, English C++, LTSPICE-intermediate Languages and and MIPOWER-intermediate, Html, Data Analyst"
137,Berton Frensche,bfrensche3s@illinois.edu,Male,"Data Analyst Business, Sql Server 2008, Designing And Devevoping Websites By Writing Html, English Business, Visual Basic 6, Data Analyst"
138,Woodman Busswell,wbusswell3t@google.ru,Male,"Linux, ireport, Management Business, NodeJS, Python, Data Analyst"
139,Anitra Ortzen,aortzen3u@360.cn,Female,"AWS, JavaScript NodeJS, Sql Server 2008, MySQL, Dhtml, Python"
140,Debbie Fudge,dfudge3v@oaic.gov.au,Female,"Agile, UIUX, Business, LTSPICE-intermediate Languages and and MIPOWER-intermediate, Python, Data Analyst, Data Analyst"
141,Doroteya Bass,dbass3w@unicef.org,Female,"Python Software Packages Interpreters-Anaconda, CSS Data, LabView, Database  Control System Design, Golang Python, Network Management"
142,Allsun Deverille,adeverille3x@alexa.com,Female,"ASP.NET Tester, Product, SQL, LabView, Android 2D AutoCAD, Programmining Using Visual Basic Language"
143,Elonore Glazebrook,eglazebrook3y@imgur.com,Female,"Html/Webpage Designing, Leader, Laravel, Javascript, JavaScript, SQL"
144,Gisela Chilver,gchilver3z@wikispaces.com,Female,"Business, Java, CSS Data, Data Analyst, AWS PHP, Business"
145,Daphna Smye,dsmye40@mashable.com,Agender,"Agile, .NET PHP, AWS Java, Jupyter Notebook, HTML5, Python3"
146,Ashton Alliker,aalliker41@rakuten.co.jp,Agender,"people management, NoSQL Java, Database, MySQL-Basics, DotNet Development It Support, Management"
147,Ilse Gerram,igerram42@netlog.com,Female,"NoSQL NodeJS, Jquery, Cloud Java, Html, Business, Golang Team"
148,Henriette Greiser,hgreiser43@msn.com,Female,"Project Management Skills, Scala DevOps, MS Exchange Server, Database, Data Science, Web MS Excel"
149,Giana Bremen,gbremen44@huffingtonpost.com,Female,"Management Business, Designer C++, ireport, Scala DevOps, SQL Data, Python"
150,Heinrick Capineer,hcapineer45@salon.com,Male,"Golang Team, Data Analyst, Team, ERP, SQL Tester, English"
151,Tory Moncrieffe,tmoncrieffe46@time.com,Female,"qlickview Microsof Office, Rails, SQL, HP Quality Centre, Laravel, Linux"
152,Zedekiah Giacomozzo,zgiacomozzo47@nps.gov,Male,"Scrum Database, Data Analyst, Linux, i can work on deadlines Business Development, Data Analyst Business, Agile Business"
153,Reinwald Caswill,rcaswill48@nsw.gov.au,Genderfluid,"Golang Team, Linux, Debian-Kali Linux    IOT, Data Analyst, Python, Web MS Excel"
154,Clem Nettle,cnettle49@lulu.com,Male,"Cloud PHP, SQL Database, 3D  AutoCAD  Database, LabView, Data Analyst, HTML"
155,Janeva Tadgell,jtadgell4a@ocn.ne.jp,Non-binary,"Database, sql, Illustrutor, NoSQL NodeJS, Python, AWS Ruby"
156,Waldemar Laudham,wlaudham4b@merriam-webster.com,Male,"Python, C, Data Analyst, Data Analyst Business, PostgreSql Python, Cloud PHP"
157,Flora Fricker,ffricker4c@eepurl.com,Female,"Cloud Database, QA, Designing And Devevoping Websites By Writing Html, Rails, MySQL, NoSQL NodeJS"
158,Kile Spinelli,kspinelli4d@about.me,Male,"i can work on deadlines Business Development, Data Analyst, Sql Server 2008, AWS, Test Results Analysis Microsoft Access With Sql, Data Analyst Business"
159,Foss Trusler,ftrusler4e@google.es,Male,"Python, Jquery, Data Analyst, Data Analyst, SQL Database, Sql Server Photoshop"
160,Darsey Sams,dsams4f@bloomberg.com,Female,"SQL Tester, Team, C#, English Business, Csharp, MATLAB"
161,Shawn Keetley,skeetley4g@economist.com,Female,"HTML, Data, people management, ireport, i can work on deadlines Business Development, Csharp"
162,Wye Inseal,winseal4h@baidu.com,Male,"Rails, Linux, Microsoft Powerpoint. RECOGNITION Academic Secured First place in B.Tech.   AI, QA, DevOps NodeJS, Network Management"
163,Jocko Feldman,jfeldman4i@noaa.gov,Male,"Cloud Database, English Data, Engineering Database, SQL Database, qlickview Microsof Office, Django Python"
164,Phineas Aucourte,paucourte4j@nytimes.com,Male,"SQL Database, SQL Database, Python, HTML5, word, MySQL Database"
165,Gustave Snoxell,gsnoxell4k@phoca.cz,Male,"Data Analyst, Linux, NoSQL Java, Data Analyst, General IT Management, Designer C++"
166,Guillermo Kuban,gkuban4l@google.es,Male,"indesign, SQL Python, DevOps NodeJS, DevOps NodeJS, PostgreSql Python, SQL SQL"
167,Biron Litzmann,blitzmann4m@soup.io,Male,"Python, .NET PHP, C++, SQL SQL, NodeJS, Ubuntu"
168,Micky Baldung,mbaldung4n@dot.gov,Female,"Project, Python, Microsoft Support, Cloud PHP, LTSPICE-intermediate Languages and and MIPOWER-intermediate, Spring NodeJS"
169,Florie Delos,fdelos4o@flickr.com,Female,"QC Business, Data Analyst, Data, Database, AWS, Rails Ruby"
170,Ardelia Scini,ascini4p@prlog.org,Female,"on, NodeJS, Scala Python, Python, MySQL PHP, Asp Programming With Access Db"
171,Melisenda Rhoddie,mrhoddie4q@youku.com,Female,"Golang Java, Python, Data Analyst, LabView, Data Analyst, Illustrutor"
172,Selby Sulter,ssulter4r@latimes.com,Male,"Project, HTML, AWS, Python, Data Analyst Business, MySQL"
173,Georgeanna Gregson,ggregson4s@shop-pro.jp,Female,"C#, ireport, Database, MySQL, SQL Python, sql"
174,Glynda Dobbison,gdobbison4t@webmd.com,Female,"Java, Designing And Devevoping Websites By Writing Html, Data Analyst, Python WebFrameWork-Django, PostgreSql Python, UIUX, Business"
175,Andrej Arrighetti,aarrighetti4u@ameblo.jp,Male,"AWS Java, Agile, Scala Python, MySQL, C# .NET 4.0, ireport"
176,Darlleen Bizley,dbizley4v@slate.com,Female,"Angular PHP, Python2, MySQL, Python, Data Analyst, Python Software Packages Interpreters-Anaconda"
177,Arni Hayne,ahayne4w@foxnews.com,Male,"SQL Tester, QA, i can build online stores and also promote websites using google adwords, MySQL, Database Business, ASP.NET Tester"
178,Berty Clyne,bclyne4x@bbc.co.uk,Male,"Leader SQL, MySQL, PHP PHP, English Business, Python, QA Business"
179,Anna-diane Leith,aleith4y@youtu.be,Female,"HTML, Csharp, NodeJS Python, Data Analyst Business, AWS Ruby, PostgreSql"
180,Teodor Musson,tmusson4z@ftc.gov,Male,"Linux, English Business, DotNet Development It Support, Database, Leader, Javascript"
181,Kory Siebert,ksiebert50@state.gov,Male,"Python, Data Analyst, Microsoft Support, Database, Golang Java, LabView"
182,Lorianne Plunkett,lplunkett51@who.int,Female,"Leader, Data Analyst Business, SQL, Agile, NodeJS, Python"
183,Evelyn Conville,econville52@example.com,Female,"Agile, Networking Python, Database, Designer C++, Project, Django Python"
184,Erena Scawen,escawen53@simplemachines.org,Female,"Programmining Using Visual Basic Language, Engineering, Xampp, Data Analyst, SQL Python, i can build online stores and also promote websites using google adwords"
185,Andreana La Torre,ala54@etsy.com,Female,"Agile, Data Analyst Business, Test CAse Execusion, Data Analyst, MS TFS, Database"
186,Carla Egleton,cegleton55@kickstarter.com,Female,"Project, powerbi, Networking C++, Team, Html, PostgreSql NodeJS"
187,Burnaby Otterwell,botterwell56@elpais.com,Male,"ASP.NET, Data Analyst, C# .NET 4.0, Database, Laravel Python, Cloud Database"
188,Moreen Eccleston,meccleston57@ft.com,Female,"QA, Data Analyst, Database, English Database, Dhtml, Programming in-Python"
189,Glen Camplen,gcamplen58@unicef.org,Female,"Data Analyst, Test Strategy Development, Management Business, Python, OOP, Database"
190,Roseanna Puckett,rpuckett59@odnoklassniki.ru,Genderqueer,"MySQL PHP, Data Analyst, Project, Python, Python, English Business"
191,Valaree Billin,vbillin5a@geocities.com,Female,"Django Python, Agile, Data Analyst, Data Analyst, Java IDE-Eclipse Operating Systems Windows, UIUX, Business"
192,Rodolphe Gwilym,rgwilym5b@gov.uk,Male,"OOP, Programmining Using Visual Basic Language, HTML, Analytics, on, MSSQL"
