id,name,email,gender,skills
779,Nicolette Lashmar,nlashmarlm@privacy.gov.au,Polygender,"SQL, Remote Executing Commands On Systems, AWS PHP, Python, Data Analyst Business, MySQL"
780,Chevalier Ellerton,cellertonln@google.cn,Male,"Data Analyst Business, powerpoint, QC Business, ireport, Database, AWS"
781,Valentino Gianettini,vgianettinilo@fotki.com,Male,"Golang Team, Agile, Sql Server Photoshop, ASP.NET Tester, Data Analyst, SQL Business"
782,Emelina Loins,eloinslp@people.com.cn,Female,"UIUX, Business, PostgreSql, Github (GitBash), NoSQL NodeJS, Asp .NET oracle, MySQL PHP"
783,Ruben Lyles,rlyleslq@amazon.de,Male,"Html, QA Business, qlickview Microsof Office, Data Analyst, Data Analyst, i can build online stores and also promote websites using google adwords"
784,Brandise Caccavella,bcaccavellalr@google.co.uk,Female,".NET PHP, Laravel Python, Csharp, Microsoft Support, Database, Data Analyst"
785,Brandy Clymo,bclymols@yelp.com,Male,"Electric Machinery, Data Analyst, SQL, Data Analyst, Python, MySQL"
786,Charlie Magnus,cmagnuslt@squidoo.com,Male,"Android 2D AutoCAD, Illustrutor, ireport, SQL Java, AWS PHP, Xampp"
787,Beverlie Tallet,btalletlu@chicagotribune.com,Female,"MATLAB, Data Analyst, Project, AWS Java, PHP Ruby, Python"
788,Krista Traite,ktraitelv@rediff.com,Female,"MATLAB, C, Programming in-Python, Illustrutor, Agile Business, Data Analyst"
789,Camile Fagg,cfagglw@tmall.com,Female,"Debian-Kali Linux    IOT, Golang Java, Data Analyst, MySQL, Data Analyst, LabView"
790,Beatrice Abbis,babbislx@purevolume.com,Female,"Python, QA, Python, HP Quality Centre, Data Analyst"
791,Ber Lightbowne,blightbownely@abc.net.au,Male,"Golang Java, C++, UIUX, Business, Database, Test CAse Execusion, Python"
792,Cord Staden,cstadenlz@merriam-webster.com,Male,"Python, Microsoft Excel, Golang Java, QC Business, Python, Data Analyst Business"
793,Wilburt Ondrousek,wondrousekm0@friendfeed.com,Male,"DevOps NodeJS, Python, indesign, JavaScript, Network Management, Data Analyst"
794,Diarmid Withnall,dwithnallm1@hatena.ne.jp,Male,"Project, Spring NodeJS, Data Analyst, JavaScript, Javascript, Scrum Business"
795,Caz Ribou,criboum2@businessweek.com,Male,"Python, Agile, MySQL, Management Database, MySQL Database, Python"
796,Francklyn Houldey,fhouldeym3@edublogs.org,Male,"Management, Python, Electric Machinery, Crystal Reports, Financial Managment SQL, Cloud Java"
797,Daria Farlam,dfarlamm4@hp.com,Female,"Data Science, Laravel, PostgreSqlPsychology Degree, Agile, Linux, HTML5"
798,Dru Burndred,dburndredm5@google.com.br,Non-binary,"word, C++, powerbi, Illustrutor, Java, Laravel PHP"
799,Evelin Poter,epoterm6@wisc.edu,Male,"Database, MySQL, Data Analyst, Designing And Devevoping Websites By Writing Html, Data Analyst, ireport"
800,Debora Ervine,dervinem7@ibm.com,Female,"Python, on, UIUX, Business, indesign, Python, Engineering Database"
801,Petronille Passe,ppassem8@gmpg.org,Female,"Javascript, Agile, ERP, General IT Management, qlickview Microsof Office, Css"
802,Waylan Wesgate,wwesgatem9@about.me,Male,"Network Management, English Business, SQL SQL, NodeJS, Data, Data Analyst"
803,Olga Longland,olonglandma@foxnews.com,Female,"Data Analyst, Data Analyst, Python, MySQL, Data Analyst, Csharp"
804,Sanderson Low,slowmb@ox.ac.uk,Male,"JavaScript, C, Golang Java, Java IDE-Eclipse Operating Systems Windows, sql, Management"
805,Jessamine Hankard,jhankardmc@ustream.tv,Female,"Python, Cloud Cloud, Spring NodeJS, Dhtml, Data Analyst, Data Analyst"
806,Charin Scamadin,cscamadinmd@techcrunch.com,Female,"Microsoft Support, Golang Python, Cloud PHP, MySQL-Basics, NodeJS, Cloud PHP"
807,Teresina Raistrick,traistrickme@example.com,Female,"indesign, Rails Ruby, Designer C++, Pycharm, Golang Python, AWS"
808,Rania Bendall,rbendallmf@twitpic.com,Female,"Crystal Reports, QC Business, Test CAse Execusion, System, Remote Executing Commands On Systems, NoSQL NodeJS"
809,Cullin Longmuir,clongmuirmg@answers.com,Male,"Test Case/Matrix Development, English Business, Data Analyst, Designing And Devevoping Websites By Writing Html, MySQL PHP, HTML5"
810,Brent Souch,bsouchmh@g.co,Male,"Scala Python, on, General IT Management, Database, MATLAB, qlickview Microsof Office"
811,Patton Machel,pmachelmi@jiathis.com,Male,"MySQL, Python, HTML, Honours Degree Psychology, Web MS Excel, Python"
812,Mischa Happel,mhappelmj@google.pl,Male,"Microsoft Support, PostgreSqlPsychology Degree, QC Business, Robotics  Reports, Agile, Python"
813,Francois Gaspard,fgaspardmk@dot.gov,Male,"Data Analyst, MySQL, HTML5, SQL Python, Database, Python"
814,Shelley Edginton,sedgintonml@booking.com,Female,"Scala DevOps, MySQL, Laravel Python, English, Designing And Devevoping Websites By Writing Html, Data Analyst"
815,Clarinda Vickress,cvickressmm@flavors.me,Female,"Database, Css, Network Management, System, Management Database, SQL"
816,Cybil Hawgood,chawgoodmn@sbwire.com,Female,"Rails, Test Case/Matrix Development, QA Business, Data Analyst, Data Analyst, Scrum Business"
817,Ceciley Pikhno,cpikhnomo@ucoz.ru,Female,"Linux, NodeJS, AWS Java, Management, AWS Ruby, MySQL Database"
818,Randi Tryme,rtrymemp@163.com,Male,"Linux, Python, PHP NodeJS, Data Analyst, Data Analyst, Python WebFrameWork-Django"
819,Merlina Chessum,mchessummq@xrea.com,Female,"QC Business, SQL, C C++, 3D  AutoCAD  Database, Python, Data Analyst"
820,Luce MacPaden,lmacpadenmr@samsung.com,Polygender,"Scala Python, Agile, Python, JavaScript NodeJS, Cloud PHP, MySQL"
821,Jennee Roncelli,jroncellims@weebly.com,Female,"MySQL, QA, MySQL, Agile, Dreamweaver, QA"
822,Gweneth Samms,gsammsmt@free.fr,Female,"DotNet Development It Support, Scala Python, JavaScript, Cloud Database, AWS Ruby, MySQL PHP"
823,Tonia Chritchlow,tchritchlowmu@histats.com,Female,"Golang Python, Designer C++, General IT Management, Linux, HTML5, Leader SQL"
824,Maynard Tree,mtreemv@go.com,Male,"Python, PostgreSqlPsychology Degree, Python, MySQL, Data Analyst, QC Business"
825,Pearl O'Lehane,polehanemw@gov.uk,Female,"Data Analyst, Asp Programming With Access Db, Laravel, Pycharm, Database, Rails"
826,Jeth Middas,jmiddasmx@cbslocal.com,Male,"MS TFS, JavaScript, SQL Data, SQL, .NET Oracle, Data Analyst"
827,Ezri Lumbley,elumbleymy@discovery.com,Male,"SQL Java, Asp .NET oracle, English, Management, Test Case/Matrix Development, Python"
828,Vita Blissett,vblissettmz@topsy.com,Female,"Management, Angular PHP, Javascript, Java, QA, Spring NodeJS"
829,Berton Elrick,belrickn0@umich.edu,Male,"Database, on, JavaScript, Database, SQL, Management Business"
830,Michal Gerkens,mgerkensn1@theglobeandmail.com,Male,"MySQL Database, Database, Designing And Devevoping Websites By Writing Html, MySQL, English Database, Laravel"
831,Janine Ruston,jrustonn2@indiegogo.com,Genderfluid,"Data Analyst, Data Analyst, DevOps NodeJS, Database, Data Analyst, Database"
832,Stanton Penchen,spenchenn3@bloomberg.com,Male,"QA Business, Management, Jquery, Data Analyst Business, MySQL, Data Analyst"
833,Thayne Rimmer,trimmern4@forbes.com,Male,"3D  AutoCAD  Database, Scala DevOps, System, Remote Executing Commands On Systems, NodeJS, Python"
834,Sheffie Caesman,scaesmann5@instagram.com,Male,"Agile, Python, MySQL, Java, NodeJS Python, C++"
835,Burk Trimmill,btrimmilln6@technorati.com,Male,"Honours Degree Psychology, NodeJS, Angular PHP, Rails Ruby, C# .NET 4.0, SQL"
836,Chad Armstrong,carmstrongn7@addtoany.com,Male,"Jquery, MySQL, Django Python, Management Business, Data Analyst, Programmining Using Visual Basic Language"
837,Jennee Loader,jloadern8@bbb.org,Female,"Robotics  Reports, Python, Management Business, Visual Basic 6, Data Analyst, Data Analyst"
838,Horatio Winram,hwinramn9@reuters.com,Male,"Python, SQL, Html, Debian-Kali Linux    IOT, Agile, Rails"
839,Reggy Addenbrooke,raddenbrookena@stumbleupon.com,Male,"Jquery, ReactJS Python, MySQL, Python3, Sql Server Photoshop, Golang Java"
840,Coralyn Rowntree,crowntreenb@edublogs.org,Female,"Test Plan Development, SQL Business, Python, SQL Tester, Dhtml, MySQL PHP"
841,Monroe Schruurs,mschruursnc@t-online.de,Male,"Data Analyst, Project, C, Project, Python, Data Analyst"
842,Corty Gregorowicz,cgregorowicznd@youtu.be,Bigender,"Python, UIUX, Business, Laravel, Project, AWS PHP, QC Python"
843,Lionello Lauderdale,llauderdalene@yellowbook.com,Male,"MS Exchange Server, Data Analyst, Data Analyst Business, HTML, C, MySQL"
844,Barry Bullman,bbullmannf@mit.edu,Polygender,"NodeJS, C#, on, Management Business, Rails, Csharp"
845,Jacinta Fowlds,jfowldsng@seesaa.net,Female,"Jquery, MySQL PHP, Test CAse Execusion, Laravel Python, English Business, Data Analyst"
846,Meg Burgise,mburgisenh@php.net,Female,"Crystal Reports, Python, SQL Java, Css, Agile, Python"
847,Burch Van der Kruys,bvanni@usnews.com,Bigender,"Data Analyst Business, Database  Control System Design, Agile, C# .NET 4.0, Laravel PHP, Python"
848,Nicholas Dikes,ndikesnj@ocn.ne.jp,Male,"MySQL-Basics, Jupyter Notebook, Database, .NET PHP, Pycharm, English C++"
849,Kristyn Shemilt,kshemiltnk@nationalgeographic.com,Female,"Data Analyst, SQL, Python, MS TFS, C C++, Data Analyst"
850,Yolanthe Trusdale,ytrusdalenl@auda.org.au,Female,"SQL Python, Scala DevOps, Microsoft Support, Debian-Kali Linux    IOT, Dreamweaver, ASP.NET Tester"
851,Allison Duham,aduhamnm@jugem.jp,Female,"Management, Golang Java, Scala DevOps, SQL Data, PHP Ruby, Data Analyst"
852,Eddie Bruniges,ebrunigesnn@quantcast.com,Female,"Team, Data Analyst, LabView, ERP, powerpoint, QA"
853,Lissy Bryers,lbryersno@opera.com,Female,"Python WebFrameWork-Django, Python WebFrameWork-Django, Agile, QC Python, Data Analyst, QA Business"
854,Sander Webley,swebleynp@vinaora.com,Male,"QC Python, Java, English Database, 3D  AutoCAD  Database, MySQL PHP, Data Analyst"
855,Robbin Fontell,rfontellnq@domainmarket.com,Female,"Scrum Database, Management Database, UIUX, Business, Data Analyst Business, MySQL, Python3"
856,Hartley Hanwright,hhanwrightnr@newsvine.com,Male,"Laravel Python, Crystal Reports, qlickview Microsof Office, SQL, Agile, Database"
857,Maje Cheng,mchengns@chicagotribune.com,Male,"Data Analyst, Database, QC Business, Cloud Cloud, Laravel, Test Strategy Development"
858,Laurens Springthorpe,lspringthorpent@uol.com.br,Male,"NodeJS Python, AWS Ruby, MySQL, Xampp, SQL, Python"
859,Nelie Gonnard,ngonnardnu@de.vu,Agender,"Laravel Python, MySQL, Python, MySQL PHP, AWS, SQL"
860,Florinda Boolsen,fboolsennv@netlog.com,Female,"Python, Python, Python, Project, Cloud Database, Database"
861,Thurstan Jahn,tjahnnw@usnews.com,Male,"Robotics  Reports, NodeJS, Robotics  Reports, Networking C++, Data, Remote Executing Commands On Systems"
862,Vernon Fedorchenko,vfedorchenkonx@netscape.com,Male,"MSSQL, Laravel, English Business, Project, Sql Server 2008, Cloud Cloud"
863,Genny Messenger,gmessengerny@amazon.co.jp,Female,"on, Cloud, Golang Java, Asp Programming With Access Db, SQL Database, MySQL Database"
864,Aharon Stode,astodenz@sun.com,Male,"ReactJS Python, Agile, JavaScript PHP, Test Plan Development, Networking Python, English Business"
865,Ranice Milthorpe,rmilthorpeo0@uol.com.br,Female,"Microsoft Excel, Data Analyst, Java, AWS PHP, Python, Cloud Java"
866,Aida Jeyness,ajeynesso1@phoca.cz,Female,"Scrum Database, PHP NodeJS, Data Analyst, 3D  AutoCAD  Database, Database  Control System Design, PHP"
867,Newton Buske,nbuskeo2@statcounter.com,Male,"Data Analyst, Designer C++, Management, Data Analyst, Engineering, Data"
868,Thaine Hurtado,thurtadoo3@hubpages.com,Male,"Data Analyst, Rails Ruby, Data Analyst, AWS Java, project management, Data Analyst"
869,Brocky Yezafovich,byezafovicho4@newsvine.com,Male,"Microsoft Word, AWS, Python2, Python, SQL Business, on"
870,Elva Coulling,ecoullingo5@nbcnews.com,Female,"Agile Business, Illustrutor, Project, Python, Programming in-Python, PHP PHP"
871,Reeta Baxill,rbaxillo6@boston.com,Female,"C, MySQL, Agile, Agile, Python, Data Analyst"
872,Kania Bum,kbumo7@topsy.com,Female,"Agile, Pycharm, Android 2D AutoCAD, SQL, Cloud PHP, on"
873,Terencio Seston,tsestono8@ft.com,Male,"English Business, Data Analyst, Sql Server 2008, English C++, Database, Golang Java"
874,Tyson Crossingham,tcrossinghamo9@prweb.com,Male,"Engineering, NoSQL NodeJS, MySQL, Python, English Database, MySQL PHP"
875,Addy Bonifant,abonifantoa@addthis.com,Genderfluid,"Test Case/Matrix Development, Data Analyst, Test Results Analysis Microsoft Access With Sql, English Business, SQL, Microsoft Support"
876,Jacobo Goggin,jgogginob@gmpg.org,Male,"Team, C, SQL, Asp Programming With Access Db, Data Analyst, Dhtml"
877,Kendra Upham,kuphamoc@latimes.com,Female,"Cloud Java, Csharp, MySQL, English, Crystal Reports, English"
878,Austin Ewells,aewellsod@nbcnews.com,Female,"MySQL, Engineering Database, Sql Server Photoshop, SQL Python, i can build online stores and also promote websites using google adwords, Sql Server Photoshop"
879,Kathie Warrack,kwarrackoe@amazonaws.com,Female,"Database, Product, SQL SQL, Scrum Business, Python, Python"
880,Royall Isakson,risaksonof@godaddy.com,Male,"Management, Scala Python, MySQL, Html/Webpage Designing, Data Analyst, Python"
881,Kendre Sponder,ksponderog@ebay.co.uk,Female,"Project, Python, Management, Asp Programming With Access Db, Microsoft Word, Asp Programming With Access Db"
882,Ryun Lesaunier,rlesaunieroh@shareasale.com,Male,"Python Software Packages Interpreters-Anaconda, Database, JavaScript PHP, MS TFS, Golang Java, Data"
883,Gerianna Kiebes,gkiebesoi@yahoo.com,Female,"MySQL, Robotics  Reports, Data Analyst, Database, AWS Ruby, Dhtml"
884,Cynthia Patise,cpatiseoj@hibu.com,Female,"Project, Robotics  Reports, C#, Agile, MySQL PHP, Machine Learning"
885,Danica Quadrio,dquadriook@umich.edu,Female,"AWS Ruby, Csharp, Golang Java, Golang Java, English Data, Test Strategy Development"
886,Devinne Baynard,dbaynardol@tiny.cc,Female,"MySQL-Basics, on, Database, Business, Data Analyst, Designer C++"
887,Paxon Oles,polesom@bizjournals.com,Genderqueer,"Database, Golang Java, HP Quality Centre, MySQL, Rails, SQL Data"
888,Aida McGahy,amcgahyon@europa.eu,Female,"QA, Android 2D AutoCAD, Networking C++, Java, UIUX, Business, Golang Team"
889,Vladamir Bamell,vbamelloo@huffingtonpost.com,Male,"MySQL, Python, English Business, Team, JavaScript NodeJS, QA"
890,Bayard Newitt,bnewittop@etsy.com,Male,"Business, Golang Java, Pycharm, AWS Ruby, JavaScript, MSSQL"
891,Julie Fontenot,jfontenotoq@aol.com,Female,"Data Analyst, AWS, LTSPICE-intermediate Languages and and MIPOWER-intermediate, English Business, powerpoint, Project"
892,Addy Tearny,atearnyor@auda.org.au,Female,"indesign, Test Case/Matrix Development, SQL, Html, QA, English Database"
893,Vernor Strowan,vstrowanos@acquirethisname.com,Male,"Linux, Cloud Java, Rails Ruby, Data Analyst, Microsoft Powerpoint. RECOGNITION Academic Secured First place in B.Tech.   AI, QA Business"
894,Tiebout Georges,tgeorgesot@baidu.com,Male,"on, Rails Ruby, Data Analyst, Asp Programming With Access Db, SQL, SQL"
895,Barry Mitkcov,bmitkcovou@narod.ru,Genderfluid,"Python, Python, Data, Python, Python, Test CAse Execusion"
896,Katherina Franzewitch,kfranzewitchov@hostgator.com,Female,"Scala DevOps, SQL Tester, Data Analyst, Data Analyst, Python, JavaScript"
897,Sloane Paoletto,spaolettoow@icq.com,Male,"MySQL, Spring NodeJS, Management Business, Data Analyst, Python, Jquery"
898,Binnie Buten,bbutenox@sitemeter.com,Female,"Csharp, General IT Management, Data Analyst, Project, Data Analyst, System"
899,Elliot McGettrick,emcgettrickoy@livejournal.com,Male,"Pycharm, JavaScript NodeJS, PHP PHP, Honours Degree Psychology, I have more than 3 years experience developing websites and also in graphic degsing, Forecasts English"
900,Grenville Rees,greesoz@exblog.jp,Male,"indesign, Database, SQL, SQL, Data Analyst, Data Analyst"
901,Domingo Rotchell,drotchellp0@godaddy.com,Male,"SQL Tester, Crystal Reports, Github (GitBash), .NET Oracle, Engineering Database, Golang Python"
902,Dunn Eastmead,deastmeadp1@unblog.fr,Male,"Python, Golang Java, AWS, powerbi, Data Science, Laravel PHP"
903,Sarette Scroxton,sscroxtonp2@domainmarket.com,Female,"DotNet Development It Support, English Business, C# .NET 4.0, Remote Executing Commands On Systems, QA, LabView"
904,Debbi Beckham,dbeckhamp3@europa.eu,Genderqueer,"Scrum Database, Asp Programming With Access Db, MySQL, Agile Business, JavaScript, Test Plan Development"
905,Merrie Yeude,myeudep4@yellowbook.com,Female,"MySQL, Data Analyst Business, NodeJS, Project Management Skills, English, project management"
906,Hedvige Burlingham,hburlinghamp5@nhs.uk,Female,"QC Business, MySQL, Java, .NET Oracle, English, qlickview Microsof Office"
907,Felecia Carbery,fcarberyp6@google.es,Female,"3D  AutoCAD  Database, Forecasts English, Python, Business, MS Exchange Server, Laravel"
908,Helena Brosio,hbrosiop7@plala.or.jp,Female,"Dhtml, Data Science, SQL, Database, Financial Managment SQL, English Business"
909,Cheryl Cawdell,ccawdellp8@ucla.edu,Female,"Spring NodeJS, Html, Data Analyst, Management, NoSQL Java, Laravel PHP"
910,Whitaker Kretschmer,wkretschmerp9@moonfruit.com,Genderqueer,"Remote Executing Commands On Systems, Data Analyst, Asp Programming With Access Db, MySQL PHP, Business, MySQL"
911,Grantham Hoofe,ghoofepa@earthlink.net,Genderqueer,"PostgreSql NodeJS, Data Analyst, Linux, QC Business, Designing And Devevoping Websites By Writing Html, English"
912,Hammad Jobling,hjoblingpb@eventbrite.com,Male,"Python, .NET Oracle, on, Data Analyst Business, Golang Java, Laravel Python"
913,Clarance Labone,clabonepc@sogou.com,Male,"Management Business, JavaScript NodeJS, HTML5, Python, English, Agile"
914,Bernardine Girogetti,bgirogettipd@goo.gl,Female,"QA, Pycharm, Python, English Business, JavaScript PHP, Linux"
915,Morgan Kusick,mkusickpe@shinystat.com,Female,"Python Software Packages Interpreters-Anaconda, PHP NodeJS, SQL Data, Scrum Database, Database, Agile Business"
916,Winslow Hanmer,whanmerpf@merriam-webster.com,Male,"Laravel Python, LabView, Database, UIUX, Business, Data Analyst, QA"
917,Zebulon Porcas,zporcaspg@godaddy.com,Male,"C# .NET 4.0, NoSQL NodeJS, Scala DevOps, Golang Team, Linux, MySQL-Basics"
918,Pen Scotchmer,pscotchmerph@yolasite.com,Female,"Python, Python, Python, SQL SQL, Javascript, .NET PHP"
919,Godfree Cardinal,gcardinalpi@wikispaces.com,Male,"Leader, MS Exchange Server, PostgreSql NodeJS, indesign, Java, Html/Webpage Designing"
920,Thurston Copper,tcopperpj@cbsnews.com,Male,"Dhtml, NodeJS, Python WebFrameWork-Django, Data Science, Scrum Business, SQL"
921,Berte Jaquet,bjaquetpk@virginia.edu,Bigender,"Test CAse Execusion, Agile Business, project management, Agile Business, MySQL, English Data"
922,Selestina Sterre,ssterrepl@hud.gov,Female,"Python, UIUX, Business, Data Analyst, SQL Python, English Business, Python"
923,Carson Brantzen,cbrantzenpm@istockphoto.com,Male,"Data Analyst, on, C++, UIUX, Business, Forecasts English, Laravel Python"
924,Torrie Kelleway,tkellewaypn@livejournal.com,Female,"Microsoft Powerpoint. RECOGNITION Academic Secured First place in B.Tech.   AI, SQL Data, ASP.NET Tester, powerbi, PHP NodeJS, C++"
925,Randell Rodear,rrodearpo@soundcloud.com,Genderfluid,"System, SQL Tester, Python, Python WebFrameWork-Django, Golang Java, Scala DevOps"
926,Algernon Coate,acoatepp@delicious.com,Male,"Jupyter Notebook, word, Laravel PHP, Database Business, Data Analyst, English Business"
927,Sallee Mival,smivalpq@hexun.com,Female,"Cloud Java, MySQL, Data Analyst, Laravel PHP, Data Analyst, Database"
928,Corbett Stanmer,cstanmerpr@psu.edu,Male,"SQL, Database, MATLAB, Database Business, Programmining Using Visual Basic Language, Jupyter Notebook"
929,Helsa Kliemke,hkliemkeps@army.mil,Female,"Database, HTML5, Java, Agile, Visual Basic 6, Sql Server 2008"
930,Mattie Pawnsford,mpawnsfordpt@webs.com,Polygender,"Data Analyst, C, HP Quality Centre, Python WebFrameWork-Django, Leader SQL, Python"
931,Ebba Clulee,ecluleepu@mozilla.org,Female,"Management Business, Designing And Devevoping Websites By Writing Html, Project Management Skills, Golang Team, SQL, PostgreSqlPsychology Degree"
932,Jeremiah Eynon,jeynonpv@sitemeter.com,Male,"Agile Business, AWS, Flask, System, Crystal Reports, Programmining Using Visual Basic Language"
933,Krystyna Scranny,kscrannypw@bluehost.com,Female,"Laravel PHP, Asp .NET oracle, Management, Data Analyst, Database, Linux"
934,Cordi Sandham,csandhampx@cnbc.com,Female,"C++, Asp .NET oracle, English Business, Data Analyst, .NET Oracle, Golang Java"
935,Astra Faltin,afaltinpy@lycos.com,Female,"Golang Java, C C++, English Business, English Business, Css, i can work on deadlines Business Development"
936,Carolus Triswell,ctriswellpz@altervista.org,Male,"Data Science, Designer C++, Csharp, Programming in-Python, Database, QA Business"
937,Brion Ibeson,bibesonq0@sun.com,Male,"LabView, Database, Management Business, PHP, QC Business, Data Analyst"
938,Tabitha Norton,tnortonq1@addthis.com,Female,"C, MySQL, Python, Linux, Scala Python, Designing And Devevoping Websites By Writing Html"
939,Tynan Badman,tbadmanq2@home.pl,Male,"OOP, Designing And Devevoping Websites By Writing Html, Scrum Business, qlickview Microsof Office, Crystal Reports, project management"
940,Lianna Jeannet,ljeannetq3@nhs.uk,Female,"Test Plan Development, Agile, Rails, Javascript, Cloud, C"
941,Wilmar Metheringham,wmetheringhamq4@uiuc.edu,Male,"LabView, Python, ireport, SQL, Data Analyst, Scala DevOps"
942,Andriana Bouchier,abouchierq5@domainmarket.com,Female,"Networking Python, AWS Java, English Business, NodeJS, HTML, Python"
943,Max Leftridge,mleftridgeq6@trellian.com,Male,"Data Analyst, General IT Management, PHP Ruby, powerpoint, Data Analyst, Python"
944,Silvana Yeulet,syeuletq7@ucoz.ru,Female,"Python, Flask, Project, General IT Management, 3D  AutoCAD  Database, Cloud Database"
945,Lauritz Pigdon,lpigdonq8@about.com,Male,"on, MySQL, Spring NodeJS, Data Analyst, English Database, JavaScript"
946,Genia Gaudin,ggaudinq9@smh.com.au,Female,"powerbi, ReactJS Python, .NET PHP, Dreamweaver, System, PHP Ruby"
947,Klaus Cadle,kcadleqa@altervista.org,Male,"Golang Java, Python, Database, Data Analyst Business, English Business, C# .NET 4.0"
948,Garrard Whayman,gwhaymanqb@unc.edu,Male,"Machine Learning, Management Business, Agile Business, Management Database, Web MS Excel, qlickview Microsof Office"
949,Stacee Farlamb,sfarlambqc@goo.gl,Female,"Dreamweaver, .NET Oracle, Python, powerpoint, people management, English Business"
950,Job Willerstone,jwillerstoneqd@youku.com,Male,"Illustrutor, SQL Python, AWS, MySQL PHP, Python, people management"
951,Beck O'Neal,bonealqe@nytimes.com,Male,"MySQL PHP, Database, Agile, Database, Agile, PHP PHP"
952,Nickolai Lutz,nlutzqf@google.cn,Genderqueer,"PostgreSql, Data Analyst, Laravel, Data Analyst, Python, SQL Business"
953,Jule Lorant,jlorantqg@drupal.org,Male,"Python, Python Software Packages Interpreters-Anaconda, Python, QC Python, QC Business, Management Business"
954,Kali Lago,klagoqh@barnesandnoble.com,Female,"Golang Python, Python, Test Plan Development, C++, Management, PostgreSql"
955,Morris Boobyer,mboobyerqi@woothemes.com,Male,"Data Analyst, Data Analyst, Java, Microsoft Excel, Agile, Python"
956,Elka Bale,ebaleqj@arizona.edu,Non-binary,"ireport, Management Business, QA, Linux, JavaScript NodeJS, Data Analyst"
957,Findley Kintzel,fkintzelqk@jiathis.com,Male,"Data Analyst Business, MySQL, Management, SQL SQL, Data Analyst, Data Analyst"
958,Verla Pischoff,vpischoffql@4shared.com,Female,"Data Analyst, Agile, Github (GitBash), C, Scrum Business, NodeJS"
959,Joseito Peskin,jpeskinqm@comsenz.com,Male,"Data Analyst, Electric Machinery, PostgreSql, Python, Data Analyst, Scrum Database"
960,Daisey Bithell,dbithellqn@si.edu,Female,"UIUX, Business, Scala Python, ireport, AWS PHP, SQL, Rails"
961,Aleksandr Epton,aeptonqo@marketwatch.com,Male,"Python, C++, Scrum Business, UIUX, Business, Data Analyst Business, UIUX, Business"
962,Rozanna Cluff,rcluffqp@fema.gov,Female,"Asp Programming With Access Db, SQL, Golang Java, Programmining Using Visual Basic Language, Cloud Cloud, Forecasts English"
963,Zea Lister,zlisterqq@engadget.com,Female,"indesign, C++, Data Analyst, Cloud PHP, Blockchain, Agile"
964,Dian Imorts,dimortsqr@dailymail.co.uk,Female,"Data Science, MySQL, Agile, NodeJS Python, Python, QC Business"
965,Reeva Delbergue,rdelbergueqs@ucoz.com,Female,"C, Database, C++, Test Strategy Development, Python, Golang Java"
966,Honey Longstaffe,hlongstaffeqt@godaddy.com,Female,"Agile, NodeJS Python, Python, Project, Python, Java"
967,Baldwin Tuftin,btuftinqu@huffingtonpost.com,Male,"Management, English Business, Team, Data Analyst, Cloud Java, Cloud"
968,Ulick Penwarden,upenwardenqv@cargocollective.com,Male,"Programmining Using Visual Basic Language, Linux, Database, Management Database, Golang Team, C#"
969,Mathe Heugel,mheugelqw@foxnews.com,Male,"Ubuntu, Python, Electric Machinery, Data Analyst, CSS Data, MS TFS"
970,Evvy Rampage,erampageqx@jalbum.net,Female,"English C++, Crystal Reports, Data Analyst, Agile, Asp .NET oracle, Database"
971,Frederic Astling,fastlingqy@ucla.edu,Male,"ireport, Scrum Business, Sql Server 2008, sql, C# .NET 4.0, English C++"
972,Gerrie Osboldstone,gosboldstoneqz@redcross.org,Male,"Networking Python, Database Business, powerbi, HP Quality Centre, Laravel, LabView"
973,Nobe O'Boyle,noboyler0@reference.com,Male,"NodeJS, Robotics  Reports, C, English C++, Data Analyst, i can build online stores and also promote websites using google adwords"
974,Zora Fowkes,zfowkesr1@cbc.ca,Female,"Designing And Devevoping Websites By Writing Html, Data Analyst, Microsoft Support, Python, qlickview Microsof Office, Css"
975,Bobette Camamill,bcamamillr2@163.com,Female,"Python, Data Analyst, Data Analyst, HTML, Engineering Database, Rails"
976,Lissy Docwra,ldocwrar3@rediff.com,Female,"MySQL, Agile, Python, Illustrutor, MySQL, Data"
