id,name,email,gender,skills
193,Wit Gainsboro,wgainsboro5c@newsvine.com,Male,"SQL Database, Data Analyst, Java, English Business, Engineering, ASP.NET"
194,Josias Menci,jmenci5d@harvard.edu,Male,"Cloud, SQL Business, Database, DotNet Development It Support, Data Analyst, Data Analyst"
195,Ariel Nockalls,anockalls5e@tripadvisor.com,Male,"JavaScript, Data Analyst, Python, Cloud, Management Database, OOP"
196,Ilene Blouet,iblouet5f@elegantthemes.com,Non-binary,"Engineering Database, QA, MS Exchange Server, NodeJS, SQL SQL, Management"
197,Mychal Shoppee,mshoppee5g@washington.edu,Male,"MySQL, MySQL, QA, Microsoft Excel, Database, AWS"
198,Goldie Kearsley,gkearsley5h@prweb.com,Female,"NodeJS, AWS PHP, SQL SQL, Jupyter Notebook, Data Analyst, Golang Java"
199,Gawen Hubbocks,ghubbocks5i@uol.com.br,Male,"System, Test Strategy Development, Forecasts English, indesign, UIUX, Business, Agile"
200,Toby De la Perrelle,tde5j@usatoday.com,Female,"JavaScript NodeJS, i can build online stores and also promote websites using google adwords, Jupyter Notebook, ASP.NET Tester, MySQL, SQL"
201,Woodie Laudham,wlaudham5k@edublogs.org,Male,"Remote Executing Commands On Systems, Data Analyst Business, Dreamweaver, English Business, Golang Java, English"
202,Doti Guilloneau,dguilloneau5l@oracle.com,Female,"MySQL, Python, Test Case/Matrix Development, Project, English Business, Golang Java"
203,Jillie Lukes,jlukes5m@samsung.com,Female,"Golang Python, Golang Team, SQL, Python, Ubuntu, AWS Ruby"
204,Burt Rickword,brickword5n@exblog.jp,Male,"Database, SQL Database, Data Analyst Business, QC Business, .NET PHP, Leader SQL"
205,Cameron Faughey,cfaughey5o@stanford.edu,Male,"Database, Management Business, Python, Golang Java, Python, Github (GitBash)"
206,Fiann Thorogood,fthorogood5p@scientificamerican.com,Female,"Database, AWS Java, Python, Microsoft Support, Machine Learning, Team"
207,Collen Giorio,cgiorio5q@chron.com,Female,"SQL, NodeJS, Java, Data Analyst, Agile, Data"
208,Willey Linham,wlinham5r@ask.com,Male,"Scala DevOps, Analytics, SQL SQL, SQL Python, ASP.NET Tester, MySQL"
209,Stevana Szymon,sszymon5s@twitpic.com,Female,"SQL Database, Python, Data Analyst, Data Analyst, Data Analyst, Golang Java"
210,Pauly Warratt,pwarratt5t@cyberchimps.com,Male,"Networking Python, Networking C++, Scala DevOps, Golang Java, English Data, Data Analyst"
211,Sigismond Jedrzej,sjedrzej5u@ucla.edu,Male,"MySQL-Basics, QA Business, JavaScript, Data Analyst, English, English Business"
212,Lacee Mowsdill,lmowsdill5v@weather.com,Female,"Python, project management, Honours Degree Psychology, Html, Analytics, Python"
213,Judd Tamblyn,jtamblyn5w@sciencedaily.com,Male,"JavaScript PHP, LabView, Data Analyst, Management Business, NodeJS, Data Analyst"
214,Katusha Kemell,kkemell5x@who.int,Polygender,"Golang Java, Database, QA Business, SQL, UIUX, Business, English"
215,Kate Astling,kastling5y@sbwire.com,Bigender,"MS TFS, Networking Python, AWS Java, Team, NodeJS, Debian-Kali Linux    IOT"
216,Arman Scocroft,ascocroft5z@clickbank.net,Male,"Database, Data Analyst, CSS Data, Java IDE-Eclipse Operating Systems Windows, English Business, Product"
217,Murielle Henniger,mhenniger60@reference.com,Female,"QC Business, Designing And Devevoping Websites By Writing Html, Financial Managment SQL, Database, Agile, English Business"
218,Wendie Ewan,wewan61@so-net.ne.jp,Female,"Designer C++, Designing And Devevoping Websites By Writing Html, PostgreSqlPsychology Degree, PostgreSql NodeJS, QC Python, Python"
219,Kennett Glanz,kglanz62@meetup.com,Male,"SQL Java, Python WebFrameWork-Django, Python, Data, Django Python, SQL Java"
220,Violet Biddulph,vbiddulph63@netlog.com,Female,"Agile Business, Project, QA, Forecasts English, Database, Golang Java"
221,Georges Nacci,gnacci64@github.com,Male,"Data Analyst, SQL Python, project management, Database, SQL Business, UIUX, Business"
222,Tim Rainger,trainger65@youtube.com,Male,"QA, Data Analyst, Network Management, Data Analyst Business, Machine Learning, Python"
223,Graig Shambrook,gshambrook66@mayoclinic.com,Male,"Data Analyst, Data Analyst Business, SQL, AWS Ruby, Project, Data Analyst"
224,Malcolm Slowcock,mslowcock67@google.ca,Male,"Scrum Database, English Business, Html, PHP NodeJS, Data Analyst, Cloud Java"
225,Lauren Sarfat,lsarfat68@techcrunch.com,Male,"Python, Html, MySQL, QA, Linux, Management Database"
226,Karolina Brazelton,kbrazelton69@shutterfly.com,Female,"Data Analyst, Designer C++, Database, Project, Database, Data Analyst"
227,Onfre Miettinen,omiettinen6a@techcrunch.com,Male,"QA, Data Analyst, English Business, SQL Java, powerpoint, Test CAse Execusion"
228,Xerxes Ricca,xricca6b@globo.com,Non-binary,"Python, Crystal Reports, .NET PHP, SQL, Ubuntu, Ruby"
229,Patric Sherer,psherer6c@youtu.be,Male,"Blockchain, AWS, indesign, Debian-Kali Linux    IOT, NodeJS Python, on"
230,Myrle Tugwell,mtugwell6d@sogou.com,Female,"UIUX, Business, Management Database, Dreamweaver, .NET Oracle, MySQL, Project Management Skills"
231,Barnaby Bulluck,bbulluck6e@arstechnica.com,Male,"Laravel Python, Data Analyst, Data Analyst, Data Analyst, Pycharm, Data Analyst"
232,Shalna Delgardillo,sdelgardillo6f@arizona.edu,Female,"Database, QA, Management Business, LTSPICE-intermediate Languages and and MIPOWER-intermediate, Web MS Excel, Scala Python"
233,Tully Creenan,tcreenan6g@nps.gov,Male,"Database  Control System Design, sql, MySQL, C#, SQL Database, English C++"
234,Shea Burdon,sburdon6h@devhub.com,Female,"MySQL, Data Analyst, Programmining Using Visual Basic Language, NoSQL NodeJS, Microsoft Word, Python Software Packages Interpreters-Anaconda"
235,Jake Leythley,jleythley6i@huffingtonpost.com,Male,"HTML5, Honours Degree Psychology, QC Business, QA, Management Database, Python"
236,Richmound Tonnesen,rtonnesen6j@buzzfeed.com,Male,"Cloud Java, 3D  AutoCAD  Database, Microsoft Excel, SQL, Data Analyst, qlickview Microsof Office"
237,Judd Oxtiby,joxtiby6k@amazon.co.uk,Male,"Java IDE-Eclipse Operating Systems Windows, MATLAB, AWS, Html, Data Analyst, English Business"
238,Beau MacCosto,bmaccosto6l@pcworld.com,Male,"PHP Ruby, Cloud Java, MySQL-Basics, Sql Server 2008, C++, Test Strategy Development"
239,Coletta Dallewater,cdallewater6m@businessweek.com,Female,"Database, C, Microsoft Support, Programming in-Python, Data Analyst, MySQL"
240,Ingamar Banton,ibanton6n@mozilla.com,Polygender,"Agile, Python, Linux, Golang Java, AWS Java, Python"
241,Nathanial Purselowe,npurselowe6o@gravatar.com,Male,"MySQL Database, Analytics, Python, Blockchain, Data Analyst, Crystal Reports"
242,Tades Ruspine,truspine6p@mashable.com,Male,"Debian-Kali Linux    IOT, SQL, UIUX, Business, MySQL-Basics, Cloud Java, powerpoint"
243,Virgilio Wordington,vwordington6q@infoseek.co.jp,Male,"Test Strategy Development, NodeJS, Pycharm, Cloud PHP, Data Analyst, Data Analyst"
244,Vinnie Hallibone,vhallibone6r@google.co.jp,Female,"UIUX, Business, PHP, Python, Management Business, Scala DevOps, Data Analyst"
245,Sherm Swatten,sswatten6s@pinterest.com,Male,"Data Analyst, MySQL, QA, Management Business, ASP.NET, Html/Webpage Designing"
246,Allison Ramsay,aramsay6t@imageshack.us,Female,"Angular PHP, Linux, MySQL, SQL, Css, Golang Python"
247,Shell Ismay,sismay6u@mashable.com,Male,"Dhtml, Microsoft Word, JavaScript, NodeJS, Python, Jupyter Notebook"
248,Domini Klosterman,dklosterman6v@ning.com,Female,"English Business, Linux, Python WebFrameWork-Django, SQL, Database Business, Team"
249,Simonne Winckles,swinckles6w@plala.or.jp,Female,"Data Analyst Business, Scrum Business, English Business, Cloud Database, C++, Python"
250,Cristi Rutgers,crutgers6x@wordpress.org,Female,"LabView, JavaScript PHP, Cloud Java, Management Business, Networking C++, Business"
251,Amara Allon,aallon6y@oaic.gov.au,Female,"SQL, MySQL PHP, Data, Django Python, Linux, English Data"
252,Cristian Feld,cfeld6z@chron.com,Male,"JavaScript PHP, MySQL, Linux, MySQL, ASP.NET Tester, NodeJS"
253,Cesya Lindback,clindback70@boston.com,Female,"AWS Ruby, C, Golang Java, Python, Rails, Android 2D AutoCAD"
254,Andrei Gameson,agameson71@topsy.com,Female,"Scala DevOps, Database, English Business, Management Business, OOP, SQL Tester"
255,Eveline Denington,edenington72@shutterfly.com,Female,"Java, MySQL, word, Data Science, Laravel PHP, MySQL PHP"
256,Aleda Ridler,aridler73@cnn.com,Female,"Sql Server 2008, System, SQL Tester, indesign, Python2, SQL Python"
257,Barbra Wybern,bwybern74@cnn.com,Female,"qlickview Microsof Office, SQL, MySQL, Forecasts English, MySQL, Python"
258,Arabele Esche,aesche75@cnn.com,Female,"people management, Python, Github (GitBash), Microsoft Word, English Business, Cloud Java"
259,Christoffer Milella,cmilella76@alexa.com,Male,"SQL Business, Data Analyst, SQL Data, Networking Python, Database, Data Analyst Business"
260,Solomon Templeman,stempleman77@meetup.com,Male,"Management, Python, Data Analyst, Web MS Excel, NodeJS, indesign"
261,Stillman Cammidge,scammidge78@list-manage.com,Male,"QC Business, Robotics  Reports, i can work on deadlines Business Development, Rails, MATLAB, English Database"
262,Viola Lody,vlody79@globo.com,Female,"Database, MySQL, HTML, SQL Python, Database Business, Golang Python"
263,Hermon Flucks,hflucks7a@harvard.edu,Male,"ASP.NET, Spring NodeJS, Database, UIUX, Business, Data Analyst, SQL Data"
264,Cobb Tofful,ctofful7b@exblog.jp,Male,"Database, Angular PHP, Python, Sql Server Photoshop, Cloud, Pycharm"
265,Abbye Coatts,acoatts7c@mashable.com,Female,"Data Analyst, Golang Java, Programming in-Python, English Business, NoSQL NodeJS, English Business"
266,Dodie Twinterman,dtwinterman7d@nsw.gov.au,Female,"Data Analyst, MSSQL, Blockchain, MySQL, i can build online stores and also promote websites using google adwords, Project Management Skills"
267,Ibby Thwaites,ithwaites7e@amazonaws.com,Female,"Python, Laravel PHP, MySQL Database, Data Analyst, Android 2D AutoCAD, C++"
268,Brigit China,bchina7f@360.cn,Female,"Html/Webpage Designing, Data Analyst, Data Analyst, Test Plan Development, Database, qlickview Microsof Office"
269,Germain Joiris,gjoiris7g@engadget.com,Male,"Robotics  Reports, Data Analyst, AWS, AWS Ruby, Test CAse Execusion, QA"
270,Ben Durbin,bdurbin7h@nih.gov,Male,"NodeJS Python, Data Science, SQL, MySQL, Engineering Database, Python"
271,Asa Ducaen,aducaen7i@howstuffworks.com,Male,"Team, Jquery, Microsoft Support, Honours Degree Psychology, Project, Python WebFrameWork-Django"
272,Jedd Ashton,jashton7j@google.com.hk,Male,"English Business, C, Python, Dhtml, Data, PHP Ruby"
273,Alair Kemster,akemster7k@japanpost.jp,Male,"LabView, MySQL, Scrum Business, C C++, LabView, MySQL PHP"
274,Madalyn Daingerfield,mdaingerfield7l@sina.com.cn,Female,"SQL, Microsoft Word, MySQL, Python, English Business, SQL Business"
275,Rafa Goodram,rgoodram7m@shinystat.com,Female,"Python, Data, MATLAB, Data Analyst Business, NoSQL NodeJS, NodeJS"
276,Shae Rushby,srushby7n@hexun.com,Female,"English Business, .NET PHP, AWS PHP, Python, AWS PHP, SQL Database"
277,Jesus Emanuelov,jemanuelov7o@nydailynews.com,Male,"Linux, Management, English Business, C C++, LTSPICE-intermediate Languages and and MIPOWER-intermediate, Ruby"
278,Merrick Zannetti,mzannetti7p@51.la,Male,"Css, Python, HTML, MySQL, MySQL PHP, SQL"
279,Antonio Posnette,aposnette7q@discuz.net,Male,"English, ASP.NET Tester, ERP, Java, Scala Python, ASP.NET"
280,Mufinella Halse,mhalse7r@addthis.com,Female,"Data Analyst, Data Analyst, Management, MySQL, Project, Data"
281,Sybil Scough,sscough7s@yahoo.co.jp,Female,"Xampp, on, Python, English Data, QC Python, Database Business"
282,Hephzibah Muncey,hmuncey7t@delicious.com,Female,"SQL Business, Analytics, Test Results Analysis Microsoft Access With Sql, C++, Database, Data Analyst"
283,Dex Hacker,dhacker7u@tiny.cc,Male,"Data Analyst, Data Analyst Business, ERP, powerpoint, Data Analyst, UIUX, Business"
284,Roz Keer,rkeer7v@infoseek.co.jp,Female,"Management Database, project management, Scala DevOps, Networking Python, QC Business, Data Analyst"
285,Christophe Cruddace,ccruddace7w@oracle.com,Male,"Scrum Database, SQL Java, Jupyter Notebook, Python, Project, Data Analyst"
286,Jasun Strute,jstrute7x@histats.com,Male,"Dreamweaver, Scala Python, HTML, Dhtml, Cloud Cloud, SQL"
287,Lionello Harrow,lharrow7y@spiegel.de,Male,".NET Oracle, Data Analyst, HTML, English Business, Laravel, Test Strategy Development"
288,Darwin Baxter,dbaxter7z@google.fr,Male,"Project, Data Analyst Business, NodeJS Python, Golang Java, Database, Jquery"
289,Jinny Fayerman,jfayerman80@mapy.cz,Female,"NodeJS, Python, AWS Ruby, Data Analyst, Data Science, Spring NodeJS"
290,Desmond Dobrovolny,ddobrovolny81@themeforest.net,Male,"Microsoft Powerpoint. RECOGNITION Academic Secured First place in B.Tech.   AI, MySQL, Spring NodeJS, HTML, Python, Test Results Analysis Microsoft Access With Sql"
291,Sanderson Whitfield,swhitfield82@vk.com,Male,"MySQL, Laravel PHP, Data Analyst, MySQL, Engineering Database, PostgreSql Python"
292,Minne Kierans,mkierans83@epa.gov,Female,"Project Management Skills, SQL Tester, Python, on, OOP, Laravel PHP"
293,Katherine Bendtsen,kbendtsen84@columbia.edu,Female,"Data Analyst Business, Linux, English Business, Dhtml, PostgreSql, project management"
294,Guillaume Zanelli,gzanelli85@is.gd,Male,"MySQL Database, Python, Data, Python, MySQL, Python2"
295,Harrietta Ramm,hramm86@ezinearticles.com,Female,"SQL Python, Data Analyst, MySQL, English Business, Agile Business, C# .NET 4.0"
296,Korry McKernan,kmckernan87@chron.com,Female,"Data Analyst, English, Data Analyst, Financial Managment SQL, JavaScript, 3D  AutoCAD  Database"
297,Odie London,olondon88@diigo.com,Polygender,"MySQL PHP, Data Analyst, SQL, Cloud Java, JavaScript, MySQL Database"
298,Ted Proby,tproby89@ezinearticles.com,Male,"Project, JavaScript PHP, MySQL, Python, Database, Python"
299,Steven Peppett,speppett8a@github.com,Male,"Jquery, Python, Test CAse Execusion, Rails, Database, SQL Java"
300,Clementina Norres,cnorres8b@storify.com,Female,"NodeJS, Agile, HTML5, Blockchain, CSS Data, Xampp"
301,Shanie Tomaini,stomaini8c@redcross.org,Female,"Data Analyst, Designing And Devevoping Websites By Writing Html, Management Database, JavaScript PHP, Data, Data Analyst"
302,Leroy Dungay,ldungay8d@wikia.com,Bigender,"Data Analyst, Web MS Excel, English Business, LabView, Pycharm, Test CAse Execusion"
303,Nikki Zelland,nzelland8e@amazon.de,Male,"Dreamweaver, Python, Business, Product, Microsoft Word, Leader SQL"
304,Whitaker Pitkeathly,wpitkeathly8f@is.gd,Male,"Ubuntu, Python, Laravel, Engineering, Data Analyst, Golang Java"
305,Patty Kubczak,pkubczak8g@unesco.org,Polygender,"Data, Data Analyst Business, Data Analyst, Android 2D AutoCAD, Management, MySQL"
306,Margalo Heindrich,mheindrich8h@europa.eu,Female,"on, sql, Programmining Using Visual Basic Language, PHP Ruby, Agile, Python"
307,Shaina Capper,scapper8i@howstuffworks.com,Female,"MySQL, C#, qlickview Microsof Office, Data Analyst, Data, C"
308,Herta Guillain,hguillain8j@biglobe.ne.jp,Female,"Data Analyst Business, Jupyter Notebook, Data, Test Case/Matrix Development, C++, Project"
309,Derward Bonafacino,dbonafacino8k@yellowpages.com,Male,"MSSQL, 3D  AutoCAD  Database, Data Analyst, Golang Team, SQL Business, C"
310,Dorian Tesseyman,dtesseyman8l@livejournal.com,Female,"Python, Data Analyst, Database, Database, C C++, Machine Learning"
311,Kristien Howkins,khowkins8m@ucoz.com,Female,"Database  Control System Design, Test Strategy Development, Golang Java, MySQL, MySQL PHP, Golang Java"
312,Devy Bleas,dbleas8n@cam.ac.uk,Male,"PostgreSqlPsychology Degree, Java, Data Analyst, Database, Spring NodeJS, Ruby"
313,Myrvyn Floodgate,mfloodgate8o@nymag.com,Male,"Jquery, Microsoft Excel, Python, AWS Ruby, Agile, C# .NET 4.0"
314,Cherie Concannon,cconcannon8p@cmu.edu,Female,"sql, AWS Ruby, Java, Agile, Networking C++, Rails"
315,Gertrude Sains,gsains8q@fastcompany.com,Female,"Laravel, Data Analyst, Networking C++, C C++, NoSQL NodeJS, Data Analyst"
316,Lisle Presslee,lpresslee8r@shinystat.com,Male,"Project, QC Python, English, Flask, Project, Machine Learning"
317,Bee Ruddom,bruddom8s@cdbaby.com,Female,"Management, English Data, QA Business, Team, Test Case/Matrix Development, Leader"
318,Bendick Sibbering,bsibbering8t@gov.uk,Male,"Python, AWS Ruby, C++, Java, English Database, Machine Learning"
319,Lowell Paule,lpaule8u@netvibes.com,Male,"C# .NET 4.0, Data Analyst, Data Analyst, Database, Networking Python, Python"
320,Robb Weafer,rweafer8v@canalblog.com,Male,"Data Analyst, MySQL, Data, JavaScript NodeJS, AWS Ruby, Data Analyst"
321,Dario Faithorn,dfaithorn8w@si.edu,Male,"Cloud PHP, Database, Data Analyst Business, MSSQL, PHP PHP, Designing And Devevoping Websites By Writing Html"
322,Lou Mercey,lmercey8x@imdb.com,Male,"Java, Java, Test Plan Development, NodeJS, Spring NodeJS, HP Quality Centre"
323,Magdalena Keneford,mkeneford8y@networksolutions.com,Non-binary,"SQL Java, SQL, Project Management Skills, Flask, English Business, Data Analyst"
324,Dillon Fifield,dfifield8z@unc.edu,Male,"ireport, UIUX, Business, Cloud PHP, Data Analyst, DotNet Development It Support, Python2"
325,Shayne Shooter,sshooter90@huffingtonpost.com,Male,"Cloud Cloud, C++, Flask, Test Strategy Development, Rails, Python Software Packages Interpreters-Anaconda"
326,Claresta Sutch,csutch91@dyndns.org,Genderfluid,"Python, English, Database, project management, JavaScript, NodeJS"
327,Virginia Kirkpatrick,vkirkpatrick92@cpanel.net,Female,"Data Analyst, SQL Database, Engineering Database, Programmining Using Visual Basic Language, DotNet Development It Support, JavaScript"
328,Trescha Jepensen,tjepensen93@house.gov,Female,"Data, C C++, Test Case/Matrix Development, AWS Java, Data Analyst, SQL"
329,Crin Pinckney,cpinckney94@google.pl,Female,"Python, ASP.NET Tester, Test Strategy Development, Honours Degree Psychology, MySQL, NodeJS"
330,Aluino Abramcik,aabramcik95@netlog.com,Male,"Programming in-Python, Dreamweaver, Data Analyst, .NET Oracle, Agile Business, Java"
331,Braden Luten,bluten96@typepad.com,Male,"Data Analyst, Android 2D AutoCAD, Scala Python, Data Analyst, MySQL, Jquery"
332,Cinnamon Waltho,cwaltho97@wordpress.com,Polygender,"Data Analyst, Database Business, on, Html, Java, Data Analyst"
333,Nollie Rebert,nrebert98@mail.ru,Female,"Business, Rails, Agile, Microsoft Powerpoint. RECOGNITION Academic Secured First place in B.Tech.   AI, Database Business, HTML5"
334,Gaynor Speaks,gspeaks99@blogspot.com,Female,"Microsoft Excel, Cloud PHP, Android 2D AutoCAD, Microsoft Word, PostgreSql, Python"
335,Joline Aveson,javeson9a@yellowbook.com,Female,"Agile, English Data, Ubuntu, SQL Java, Asp Programming With Access Db, Project"
336,Paten Kilgallen,pkilgallen9b@sbwire.com,Male,"Android 2D AutoCAD, Database  Control System Design, Business, Data Analyst Business, Sql Server 2008, Scrum Business"
337,Dorri Imlin,dimlin9c@blogspot.com,Female,"SQL Java, Python Software Packages Interpreters-Anaconda, Jupyter Notebook, on, Electric Machinery, Ruby"
338,Chicky Stacy,cstacy9d@smh.com.au,Female,"Data Analyst, Asp .NET oracle, Crystal Reports, Robotics  Reports, SQL Python, Database"
339,Rutherford Ickovic,rickovic9e@yandex.ru,Male,"Database, System, on, English, Cloud Cloud, English Database"
340,Ramsay Helian,rhelian9f@tamu.edu,Male,"Visual Basic 6, Python, Python, Business, Python, Scala Python"
341,Alie Vivians,avivians9g@state.tx.us,Female,"Rails, C++, Agile, JavaScript, Honours Degree Psychology, UIUX, Business"
342,Joellen Algore,jalgore9h@hatena.ne.jp,Female,"Data Science, SQL Data, Engineering, Database  Control System Design, Agile, SQL Business"
343,Brigg Churchman,bchurchman9i@sina.com.cn,Male,"Sql Server Photoshop, PHP Ruby, Database, sql, AWS, Designing And Devevoping Websites By Writing Html"
344,Wilona Juggins,wjuggins9j@epa.gov,Genderqueer,"Data, Python, i can work on deadlines Business Development, Html, Python, PostgreSqlPsychology Degree"
345,Crista Mathiot,cmathiot9k@ca.gov,Female,"Database Business, project management, Leader, Java IDE-Eclipse Operating Systems Windows, SQL, QA"
346,Bronson Braunle,bbraunle9l@nhs.uk,Male,"Test Plan Development, JavaScript, MySQL, qlickview Microsof Office, Data Analyst, PHP NodeJS"
347,Tonie Twell,ttwell9m@uol.com.br,Female,"SQL, MySQL, Web MS Excel, Laravel Python, Cloud PHP, Python"
348,Markus Govier,mgovier9n@hostgator.com,Male,"Python, Golang Python, qlickview Microsof Office, MySQL, Python, Data Analyst"
349,Finn Yakebovich,fyakebovich9o@infoseek.co.jp,Male,"Database Business, Sql Server 2008, Python, CSS Data, Cloud PHP, Jquery"
350,Nananne Raincin,nraincin9p@hugedomains.com,Female,"C, Python, SQL Tester, Python, QA, Management"
351,Pembroke Hehl,phehl9q@time.com,Male,"Cloud Java, Data Analyst, MySQL, C, Python2, English Database"
352,Claudette Noir,cnoir9r@symantec.com,Female,"Python, UIUX, Business, Linux, Management, English, i can build online stores and also promote websites using google adwords"
353,Hadlee Hawkyens,hhawkyens9s@desdev.cn,Male,"English, Ubuntu, JavaScript, Python, Sql Server Photoshop, NodeJS"
354,Binni Lasselle,blasselle9t@chronoengine.com,Agender,"Management, Leader, SQL Database, Web MS Excel, Data Analyst Business, Data Analyst"
355,Julietta Birtles,jbirtles9u@cpanel.net,Female,"Python, SQL Tester, HTML, SQL Business, Data Analyst, C#"
356,Greta Kolczynski,gkolczynski9v@rambler.ru,Agender,"Data Analyst, JavaScript, i can work on deadlines Business Development, indesign, Data Analyst, Python"
357,Roger Crauford,rcrauford9w@youku.com,Non-binary,"Database, Data Analyst, Crystal Reports, Cloud Cloud, DotNet Development It Support, i can build online stores and also promote websites using google adwords"
358,Prescott Winslett,pwinslett9x@craigslist.org,Male,"Test Plan Development, Data Analyst, Test CAse Execusion, SQL Business, Programming in-Python, Project"
359,Harwell Freschini,hfreschini9y@mac.com,Male,"Business, MATLAB, Linux, Laravel PHP, Data Analyst, PHP Ruby"
360,Chico McQuorkell,cmcquorkell9z@jugem.jp,Male,"Cloud Cloud, 3D  AutoCAD  Database, MySQL, SQL Python, Financial Managment SQL, Golang Python"
361,Electra Ivey,eiveya0@mapy.cz,Female,"AWS Ruby, Database, SQL Business, Test Plan Development, Rails, Python"
362,Tess Habberjam,thabberjama1@wiley.com,Female,"Rails Ruby, Flask, Data Analyst, LabView, Ruby, Django Python"
363,Orin Heazel,oheazela2@cnn.com,Male,"Python, Management Business, NoSQL Java, Networking C++, QC Business, Golang Java"
364,Westbrooke McMinn,wmcminna3@sfgate.com,Male,"Networking C++, ERP, SQL Business, UIUX, Business, Test Results Analysis Microsoft Access With Sql, MySQL"
365,Violet Amiable,vamiablea4@ifeng.com,Female,"Data Analyst, Data Analyst, Management, Spring NodeJS, Data, on"
366,Belia Nel,bnela5@opensource.org,Female,"English Business, NoSQL Java, Java, Agile Business, English Data, Test Case/Matrix Development"
367,Tanney Antliff,tantliffa6@businesswire.com,Male,"Data Analyst, Database, English C++, Cloud Cloud, MySQL, HTML5"
368,Aretha Quantick,aquanticka7@issuu.com,Female,"Sql Server Photoshop, MS Exchange Server, Flask, AWS PHP, NodeJS, SQL SQL"
369,Willabella Leeke,wleekea8@histats.com,Female,"Data Analyst, Debian-Kali Linux    IOT, Data Analyst, Remote Executing Commands On Systems, I have more than 3 years experience developing websites and also in graphic degsing, DotNet Development It Support"
370,Vanni Grzesiak,vgrzesiaka9@oracle.com,Non-binary,"Jquery, Python, Spring NodeJS, on, Programming in-Python, Data"
371,Hewet Henrichsen,hhenrichsenaa@smugmug.com,Genderfluid,"Laravel, Asp .NET oracle, Python, Python, HTML, Golang Java"
372,Royall Carmen,rcarmenab@irs.gov,Male,"Css, Engineering, Python, Sql Server Photoshop, Robotics  Reports, i can build online stores and also promote websites using google adwords"
373,Abbey Crennan,acrennanac@nyu.edu,Male,"Rails, MySQL, MySQL, Cloud PHP, Agile Business, Data Analyst"
374,Casper Purkiss,cpurkissad@csmonitor.com,Male,"JavaScript, Python, JavaScript, Data Analyst, Debian-Kali Linux    IOT, QA"
375,Nalani Ritchard,nritchardae@sfgate.com,Female,"HTML, Networking C++, Financial Managment SQL, Data, English, Python"
376,Aubrette Bruckenthal,abruckenthalaf@nsw.gov.au,Female,"Database, Laravel Python, I have more than 3 years experience developing websites and also in graphic degsing, I have more than 3 years experience developing websites and also in graphic degsing, AWS Ruby, AWS"
377,Pepillo Rishman,prishmanag@shinystat.com,Male,"SQL Database, Networking C++, NodeJS, Data Analyst, Data Analyst, Data"
378,Freemon Pelosi,fpelosiah@indiatimes.com,Male,"I have more than 3 years experience developing websites and also in graphic degsing, SQL, Python, NodeJS Python, Leader, Data Analyst"
379,Audie MacBain,amacbainai@smugmug.com,Polygender,"Agile Business, PostgreSql, Python, Test Case/Matrix Development, MySQL, on"
380,Charis Kumar,ckumaraj@europa.eu,Female,"Python3, SQL Python, Golang Java, HTML, Database, i can work on deadlines Business Development"
381,Helaine Durek,hdurekak@google.co.jp,Genderqueer,"AWS PHP, SQL Python, JavaScript NodeJS, English C++, Python, Laravel PHP"
382,Sebastian Pickersgill,spickersgillal@ted.com,Male,"Python, .NET PHP, SQL Business, Golang Team, qlickview Microsof Office, Test Strategy Development"
383,Cortney Vassman,cvassmanam@creativecommons.org,Female,"Database Business, Database, Designing And Devevoping Websites By Writing Html, Data Analyst, Project, Financial Managment SQL"
384,Cordie Bushill,cbushillan@umich.edu,Female,"Python, Jupyter Notebook, Programming in-Python, Database, Python WebFrameWork-Django, Database Business"
385,Abrahan Cholonin,acholoninao@intel.com,Male,"QA, Database, Angular PHP, Python, Python, Rails"
386,Johnette Mixworthy,jmixworthyap@elegantthemes.com,Female,"powerbi, Data Analyst, Python, SQL, QA, Test Plan Development"
