id,name,email,gender,skills
387,Barbey Stanyland,bstanylandaq@zdnet.com,Agender,"NodeJS, Blockchain, PHP PHP, Test Case/Matrix Development, C# .NET 4.0, Data Analyst"
388,Cecil Bartley,cbartleyar@utexas.edu,Male,"Dreamweaver, Blockchain, JavaScript, ASP.NET Tester, powerpoint, Project"
389,Nealy Ferraro,nferraroas@ed.gov,Male,"Javascript, Analytics, i can work on deadlines Business Development, SQL Business, Project, Python WebFrameWork-Django"
390,Creight Bullers,cbullersat@addtoany.com,Male,"Cloud, SQL Database, indesign, Python, Python, SQL Database"
391,Modestine Rossander,mrossanderau@domainmarket.com,Female,"project management, Database Business, Microsoft Excel, Web MS Excel, SQL Python, Agile"
392,Milo Krysztofowicz,mkrysztofowiczav@mashable.com,Male,"Scrum Business, Golang Python, Xampp, MySQL Database, Networking C++, Test Strategy Development"
393,Toddy Ravilus,travilusaw@bluehost.com,Male,"Data Analyst, Test Case/Matrix Development, PHP Ruby, word, Microsoft Word, Html"
394,Curtice Bullman,cbullmanax@shop-pro.jp,Male,"Team, CSS Data, SQL Python, Data Analyst, HP Quality Centre, Microsoft Support"
395,Hubey Farress,hfarressay@shop-pro.jp,Male,"Python2, SQL Data, MySQL, OOP, Visual Basic 6, Rails"
396,Gerhardt Benninck,gbenninckaz@businesswire.com,Male,"Data Analyst Business, Programmining Using Visual Basic Language, SQL Python, Scala Python, MySQL, Python"
397,Lothaire Wicklen,lwicklenb0@time.com,Male,"Dreamweaver, Cloud Cloud, English Database, Microsoft Support, Golang Java, Microsoft Powerpoint. RECOGNITION Academic Secured First place in B.Tech.   AI"
398,Izak Gannicott,igannicottb1@naver.com,Male,"QC Business, Linux, English, Javascript, SQL Python, Xampp"
399,Lilli Scroggie,lscroggieb2@blogspot.com,Female,"Management, on, SQL Python, Designer C++, Project, Golang Java"
400,Nancy Theobalds,ntheobaldsb3@youku.com,Female,"MySQL PHP, Sql Server Photoshop, C# .NET 4.0, Database Business, Dreamweaver, powerpoint"
401,Vonnie Diem,vdiemb4@github.com,Female,"Database, Asp Programming With Access Db, SQL Business, Django Python, Database, Java"
402,Irv Gossart,igossartb5@godaddy.com,Male,"QC Business, Python, Test Plan Development, Data Analyst, QA Business, Programming in-Python"
403,Amargo Le Marquis,aleb6@auda.org.au,Female,"AWS Java, System, Agile Business, AWS PHP, JavaScript, Python"
404,Odo Isacsson,oisacssonb7@usatoday.com,Male,"Data Analyst, Data Analyst, Python, Leader SQL, Project, Business"
405,Iseabal Abrahm,iabrahmb8@bbc.co.uk,Female,"Networking C++, Data Analyst, English C++, SQL Database, C++, Data Analyst"
406,Jacquelin Mackilpatrick,jmackilpatrickb9@baidu.com,Female,"SQL Business, English Database, Agile, Networking Python, MSSQL, Web MS Excel"
407,Hector Hasel,hhaselba@sphinn.com,Male,"English Database, MySQL PHP, Rails Ruby, Flask, SQL, Team"
408,Meier Espada,mespadabb@independent.co.uk,Male,"AWS Ruby, Python, C C++, Data Analyst, Database, Agile"
409,Andreas Gorvette,agorvettebc@msn.com,Male,"JavaScript PHP, Project, Data Analyst, SQL, Rails, Database"
410,Kimball MacLaren,kmaclarenbd@gmpg.org,Male,"Javascript, Team, on, Leader SQL, English, PostgreSql NodeJS"
411,Cicely Varnals,cvarnalsbe@github.io,Female,"Data Analyst, Robotics  Reports, Remote Executing Commands On Systems, English Business, UIUX, Business, Data Analyst"
412,Erika Forten,efortenbf@sitemeter.com,Female,"Web MS Excel, Microsoft Support, MySQL, i can work on deadlines Business Development, powerbi, Python"
413,Jarrett Bakhrushkin,jbakhrushkinbg@hc360.com,Male,"Python, NoSQL Java, Agile, Cloud PHP, Cloud Database, Data Analyst"
414,Riordan Thomelin,rthomelinbh@zdnet.com,Male,"Scala DevOps, Python, Data Analyst, CSS Data, PHP PHP, Data Analyst"
415,Dar De Domenici,ddebi@arstechnica.com,Male,"MS TFS, Data Analyst, Cloud Java, NoSQL Java, Laravel, Electric Machinery"
416,Jean Risom,jrisombj@tmall.com,Male,"PHP NodeJS, Java, Python, Django Python, English Data, LTSPICE-intermediate Languages and and MIPOWER-intermediate"
417,Garrett David,gdavidbk@ezinearticles.com,Male,"Html/Webpage Designing, Database, Python, QC Business, QC Python, Project Management Skills"
418,Winn Dayment,wdaymentbl@t-online.de,Male,"PostgreSql, Python3, Csharp, Database, MySQL, Database"
419,Gennifer Batho,gbathobm@nifty.com,Female,"JavaScript, Data Analyst, QC Business, Data Analyst, Analytics, PostgreSqlPsychology Degree"
420,Morley Iskowitz,miskowitzbn@biglobe.ne.jp,Male,"Data Science, Scala Python, Business, C, Python, PostgreSql NodeJS"
421,Leonidas Stanbrooke,lstanbrookebo@youtube.com,Bigender,"Scala Python, Management Business, Golang Python, Python, Python, sql"
422,Shelagh Struys,sstruysbp@narod.ru,Female,"Data Analyst, on, QC Business, Data Analyst, Test Results Analysis Microsoft Access With Sql, SQL"
423,Reggy Breach,rbreachbq@oracle.com,Male,"Visual Basic 6, Data Analyst, PostgreSql NodeJS, Golang Java, MySQL, Data Analyst"
424,Reiko Costard,rcostardbr@digg.com,Female,"Database Business, Dhtml, powerpoint, English C++, Scala Python, Data Analyst"
425,Clemmie Canceller,ccancellerbs@printfriendly.com,Male,"SQL Business, Linux, Data Analyst Business, Project, SQL Python, Agile"
426,Jori Saintpierre,jsaintpierrebt@ca.gov,Female,"Spring NodeJS, Linux, Microsoft Word, on, Database, English"
427,Sam Smart,ssmartbu@studiopress.com,Female,"MySQL, Data Analyst, Ubuntu, HTML5, Scrum Business, Leader"
428,Melonie McQuillan,mmcquillanbv@sun.com,Female,"Data Analyst, PostgreSql NodeJS, SQL Database, ireport, MySQL, Networking Python"
429,Dorie Routledge,droutledgebw@google.it,Male,"General IT Management, Asp .NET oracle, English, Data Analyst, English Database, English C++"
430,Pansy Keaton,pkeatonbx@youtu.be,Female,"Golang Python, HP Quality Centre, Scrum Database, Data Analyst, Ruby, MSSQL"
431,Ody Theakston,otheakstonby@amazonaws.com,Male,"Java, SQL, Csharp, SQL, MySQL, Python"
432,Hamnet Rajchert,hrajchertbz@bigcartel.com,Male,"MySQL, on, English, MySQL, SQL Business, Laravel"
433,Kellby Malinowski,kmalinowskic0@bloglovin.com,Male,"English, Spring NodeJS, C C++, Data Analyst, Python, word"
434,Hayes Frissell,hfrissellc1@xing.com,Male,"SQL, Data Analyst, OOP, Data Analyst, Data Analyst, QA Business"
435,Aaron MacGuffog,amacguffogc2@vinaora.com,Male,"Data, Scrum Business, Python, Data Analyst, MS TFS, Database"
436,Tani Rumke,trumkec3@umn.edu,Genderfluid,"SQL Python, Cloud Java, Agile Business, Networking Python, AWS Java, Scrum Business"
437,Lyssa Broe,lbroec4@drupal.org,Female,"Csharp, Python, QC Business, English, Database, LTSPICE-intermediate Languages and and MIPOWER-intermediate"
438,Hashim Snowsill,hsnowsillc5@cloudflare.com,Male,"MySQL, Microsoft Word, SQL Business, ireport, Linux, Spring NodeJS"
439,Godfry Bennough,gbennoughc6@shinystat.com,Male,"Flask, Ubuntu, SQL Java, Remote Executing Commands On Systems, Asp Programming With Access Db, Data Analyst"
440,Sherie Gonthard,sgonthardc7@squarespace.com,Female,"SQL, Python, QA, Python WebFrameWork-Django, Networking C++, Test Results Analysis Microsoft Access With Sql"
441,Jania Sneddon,jsneddonc8@seattletimes.com,Female,"Golang Java, SQL, Linux, PostgreSql Python, C#, Data Analyst"
442,Marc Durning,mdurningc9@blogtalkradio.com,Male,"MySQL, Networking Python, Agile, Java IDE-Eclipse Operating Systems Windows, Microsoft Excel, SQL"
443,Hashim Jacson,hjacsonca@hubpages.com,Male,"Microsoft Word, MySQL, Networking Python, Android 2D AutoCAD, Agile, ASP.NET"
444,Noelle Kliment,nklimentcb@live.com,Female,"Data Science, MySQL, Flask, Business, Database Business, Data Analyst"
445,Loretta Matiebe,lmatiebecc@ning.com,Female,"English Business, Debian-Kali Linux    IOT, Management, SQL Business, Data Analyst Business, Test Plan Development"
446,Cordy Cronk,ccronkcd@lycos.com,Female,"SQL SQL, DevOps NodeJS, Data Analyst, Data Analyst, AWS, English Business"
447,Renard Dewdeny,rdewdenyce@opensource.org,Male,"Jquery, Database, Python, Agile, Golang Java, Management"
448,Philipa Jelk,pjelkcf@blog.com,Female,"QC Business, SQL, English Business, Data Analyst, Financial Managment SQL, Data Analyst"
449,Odelinda Schimek,oschimekcg@yellowbook.com,Female,"NodeJS, ASP.NET, Business, C++, MySQL PHP, Project Management Skills"
450,Harland Moffett,hmoffettch@csmonitor.com,Male,"i can build online stores and also promote websites using google adwords, OOP, on, Laravel PHP, MySQL-Basics"
451,Jayson Cockrell,jcockrellci@cloudflare.com,Male,"SQL, sql, Python, Blockchain, Project, LTSPICE-intermediate Languages and and MIPOWER-intermediate"
452,Sylvan Rounds,sroundscj@gravatar.com,Male,"Python, UIUX, Business, UIUX, Business, Financial Managment SQL, NodeJS Python, Data Analyst"
453,Dasie Karpe,dkarpeck@google.nl,Female,"MATLAB, Python Software Packages Interpreters-Anaconda, Data Science, Agile, Python2, JavaScript PHP"
454,Kamilah Box,kboxcl@un.org,Female,"Laravel Python, Project, Cloud PHP, Java, Data Analyst Business, Microsoft Word"
455,Patricio Belone,pbelonecm@china.com.cn,Male,"LTSPICE-intermediate Languages and and MIPOWER-intermediate, Robotics  Reports, English C++, Data Analyst, QA Business, English Business"
456,Jamima Glastonbury,jglastonburycn@infoseek.co.jp,Female,"Database, Jquery, PostgreSql Python, Scrum Database, Data Analyst, Networking C++"
457,Scot Heinl,sheinlco@networkadvertising.org,Male,"AWS Ruby, Agile, project management, Data Analyst, ASP.NET Tester, Management Business"
458,Kirk Traher,ktrahercp@t.co,Agender,"Data Analyst, ASP.NET Tester, SQL Data, Cloud Java, Management Business, Python"
459,Darbee McInnes,dmcinnescq@people.com.cn,Male,"Laravel, NodeJS, Data Analyst, DotNet Development It Support, QC Business, SQL Tester"
460,Timoteo Dellenbach,tdellenbachcr@amazon.com,Male,"SQL SQL, I have more than 3 years experience developing websites and also in graphic degsing, Database, Cloud, Project, Python"
461,Shay Gasparro,sgasparrocs@hibu.com,Genderfluid,"Scala Python, Data Analyst Business, Laravel Python, Sql Server Photoshop, Laravel, C++"
462,Godard Treacy,gtreacyct@ameblo.jp,Male,"Html, MySQL, Ruby, Remote Executing Commands On Systems, .NET PHP, Python"
463,Sigismond Pigdon,spigdoncu@xing.com,Male,"Java, PHP Ruby, QA, Business, Data Analyst, Data Analyst"
464,Kathe Pidon,kpidoncv@ox.ac.uk,Female,"Data Analyst, OOP, QA Business, Financial Managment SQL, Css, Product"
465,Adler Adkin,aadkincw@jiathis.com,Male,"Team, Golang Team, Python Software Packages Interpreters-Anaconda, English Business, PostgreSqlPsychology Degree, Scrum Business"
466,Hamil Gieves,hgievescx@baidu.com,Male,"Cloud Database, Debian-Kali Linux    IOT, i can build online stores and also promote websites using google adwords, English Database, Spring NodeJS, AWS Ruby"
467,Winnie Terbruggen,wterbruggency@constantcontact.com,Male,"Data Analyst, Data Analyst, Data Analyst, Data Analyst, ReactJS Python"
468,Gan Cammiemile,gcammiemilecz@fema.gov,Male,"Database, QC Business, English, MySQL, Agile, Database  Control System Design"
469,Skipton Heeps,sheepsd0@uiuc.edu,Male,"UIUX, Business, NodeJS, Laravel, Linux, Data, Management"
470,Lonnie Wakeley,lwakeleyd1@pinterest.com,Male,"Scala Python, QC Python, HTML, Linux, Agile, Database"
471,Deck Beaulieu,dbeaulieud2@mlb.com,Agender,"English Data, LabView, C, Css, Data Analyst, C++"
472,Derrek Ingry,dingryd3@hubpages.com,Male,"Data Analyst, Database, MySQL PHP, Rails, Jquery, Leader"
473,Marjorie Spittal,mspittald4@etsy.com,Female,"English, MySQL PHP, PostgreSql, Golang Team, Visual Basic 6, MS TFS"
474,Beverley Morais,bmoraisd5@yahoo.co.jp,Female,"JavaScript, Team, Programming in-Python, SQL, SQL Data, Leader SQL"
475,Howie Keith,hkeithd6@merriam-webster.com,Male,"Project, QA, Database, Python, SQL Business, SQL Python"
476,Cristie Cavilla,ccavillad7@whitehouse.gov,Female,"SQL, ireport, Project, Data Analyst, Python, MySQL"
477,Chic Clacson,cclacsond8@theglobeandmail.com,Bigender,"Database, Test Strategy Development, SQL SQL, Python, PHP Ruby, System"
478,Chance Botterill,cbotterilld9@squarespace.com,Male,"Data Analyst, Github (GitBash), Electric Machinery, people management, Scrum Business, on"
479,Darryl Glancy,dglancyda@wsj.com,Male,"General IT Management, JavaScript, SQL Python, MySQL, NoSQL Java, Python"
480,Fernande Harp,fharpdb@yahoo.com,Female,"Html/Webpage Designing, on, System, C, Rails, Laravel"
481,Guglielmo Flippini,gflippinidc@unblog.fr,Male,"Data Analyst, SQL, Electric Machinery, Financial Managment SQL, PHP Ruby, HP Quality Centre"
482,Mozelle Creggan,mcreggandd@foxnews.com,Female,"Data Analyst, Java, Data Analyst Business, Data Analyst, MySQL, Javascript"
483,Grace Pillington,gpillingtonde@vistaprint.com,Male,"Data Analyst, QA, Data Analyst Business, Agile Business, SQL Python, SQL Data"
484,Dickie Donat,ddonatdf@marketwatch.com,Male,"Scala DevOps, Management Business, Financial Managment SQL, qlickview Microsof Office, Blockchain, QA Business"
485,Melisenda Lampen,mlampendg@wikipedia.org,Polygender,"NoSQL Java, JavaScript, Database, System, Data Analyst Business, i can build online stores and also promote websites using google adwords"
486,Axel Luciano,alucianodh@theatlantic.com,Male,"UIUX, Business, QC Python, SQL, Jquery, QC Python, Scrum Database"
487,Valdemar Tilston,vtilstondi@surveymonkey.com,Male,"Web MS Excel, C++, QA Business, Team, Golang Java, Html/Webpage Designing"
488,Diarmid MacChaell,dmacchaelldj@aol.com,Male,"LTSPICE-intermediate Languages and and MIPOWER-intermediate, .NET Oracle, Python, Jupyter Notebook, System, Data Analyst"
489,Tessie Matejic,tmatejicdk@w3.org,Female,"Data Analyst Business, Data, Data Analyst, MySQL, Data Analyst, Agile Business"
490,Bernelle Yakov,byakovdl@constantcontact.com,Female,"Django Python, Data Analyst, Business, Database, on"
491,Haleigh Flieg,hfliegdm@ustream.tv,Female,"Data Analyst, SQL, Python, Python, QC Business, English"
492,Jody Chritchlow,jchritchlowdn@prnewswire.com,Male,"Java IDE-Eclipse Operating Systems Windows, Golang Python, AWS, Project, SQL Business, QC Business"
493,Sari Cotty,scottydo@godaddy.com,Female,"QA Business, ReactJS Python, System, English, Programmining Using Visual Basic Language, MySQL"
494,Reinhold Cinnamond,rcinnamonddp@bluehost.com,Genderfluid,"PHP, Database, ASP.NET Tester, MS Exchange Server, Debian-Kali Linux    IOT, Django Python"
495,Trixie Mounce,tmouncedq@earthlink.net,Female,"Golang Java, QC Business, English, Data, Database, Css"
496,Ike Maffione,imaffionedr@wordpress.org,Male,"PHP NodeJS, Data Science, Data Analyst, Test Plan Development, Blockchain, powerbi"
497,Alain Camp,acampds@toplist.cz,Male,"on, Ubuntu, Database, AWS Ruby, C++, PostgreSql"
498,Karin Maultby,kmaultbydt@arizona.edu,Female,"Network Management, English, Team, I have more than 3 years experience developing websites and also in graphic degsing, PHP NodeJS, PHP Ruby"
499,Kiley Gaspero,kgasperodu@amazon.de,Female,"Data Analyst, QA, Database, Dreamweaver, Data Analyst Business, UIUX, Business"
500,Cecil Diaper,cdiaperdv@hud.gov,Male,"NoSQL NodeJS, SQL Database, Database, UIUX, Business, PostgreSqlPsychology Degree, HTML"
501,Maia Tocher,mtocherdw@imgur.com,Genderfluid,"Networking C++, Project, Golang Team, Data Analyst, Spring NodeJS, Scala Python"
502,Cassius Cometson,ccometsondx@360.cn,Male,"Data Analyst, Cloud Java, Python, PostgreSql NodeJS, Laravel, Cloud Cloud"
503,Lorin Beardwood,lbeardwooddy@foxnews.com,Male,"Python, Database, Python Software Packages Interpreters-Anaconda, System, Python, Python"
504,Fiona Jura,fjuradz@multiply.com,Female,"Test Plan Development, Forecasts English, C# .NET 4.0, UIUX, Business, Linux, Management Business"
505,Roman Brotherton,rbrothertone0@tiny.cc,Male,"Python, Test Case/Matrix Development, QC Python, Data Analyst, Linux, DevOps NodeJS"
506,Rois Otterwell,rotterwelle1@indiatimes.com,Female,"QC Python, Scrum Business, SQL, SQL, UIUX, Business, SQL Python"
507,Sidoney Heaven,sheavene2@upenn.edu,Female,"Data Analyst, Spring NodeJS, English, Python, Linux, on"
508,Rafferty Ainsbury,rainsburye3@wsj.com,Male,"Data Analyst, Analytics, Data Analyst, Css, PostgreSqlPsychology Degree, Data Analyst"
509,Carson Montrose,cmontrosee4@list-manage.com,Male,"General IT Management, Scala Python, MySQL, Python, Analytics, Data Analyst"
510,Mikey Runnicles,mrunniclese5@naver.com,Polygender,"Project, Leader, English Database, Python, Data Analyst, PostgreSql Python"
511,Stevie Brockley,sbrockleye6@shinystat.com,Male,"English, English Data, Microsoft Powerpoint. RECOGNITION Academic Secured First place in B.Tech.   AI, ReactJS Python, Leader SQL, Java"
512,Jake Turneaux,jturneauxe7@foxnews.com,Male,"Microsoft Powerpoint. RECOGNITION Academic Secured First place in B.Tech.   AI, Golang Python, Data Analyst, Data Analyst, Github (GitBash), MySQL"
513,Skip Murford,smurforde8@mac.com,Male,"Data Analyst, QA, powerpoint, Angular PHP, Java, C#"
514,Ogdon Lansdale,olansdalee9@hostgator.com,Bigender,"LabView, DevOps NodeJS, QC Python, Network Management, Forecasts English, JavaScript NodeJS"
515,Eldon Durrell,edurrellea@vinaora.com,Male,"SQL, Data Science, Python, English Business, Microsoft Word, Agile"
516,Broddy Radbourn,bradbourneb@google.ca,Male,"SQL Data, C C++, Javascript, SQL, Csharp, Rails"
517,Dodi Carnson,dcarnsonec@mail.ru,Polygender,"Python, Database, Linux, Data Analyst, Spring NodeJS, Golang Java"
518,Rene Spours,rspoursed@sakura.ne.jp,Male,"MySQL Database, Python, C# .NET 4.0, Data Analyst, AWS, English C++"
519,Kenn Andrivot,kandrivotee@aboutads.info,Male,"Golang Python, Networking Python, English, Dhtml, Golang Java, Dreamweaver"
520,Ethe Rubie,erubieef@cam.ac.uk,Male,"Data Analyst, Microsoft Support, 3D  AutoCAD  Database, Data Analyst, Product, PostgreSqlPsychology Degree"
521,Mitchel Furnival,mfurnivaleg@techcrunch.com,Male,"SQL, SQL, MySQL, Python WebFrameWork-Django, English Business, Golang Java"
522,Myrle Rhys,mrhyseh@nature.com,Female,"UIUX, Business, SQL, word, Database, Rails, Python"
523,Rance Camois,rcamoisei@google.ca,Male,"Laravel Python, Management, Project, SQL Java, C++, SQL SQL"
524,Jemmy Labrom,jlabromej@mozilla.com,Female,"Data Analyst Business, Microsoft Support, MySQL, Jupyter Notebook, Project, MySQL"
525,Sylas Snoday,ssnodayek@usa.gov,Male,"Engineering Database, NodeJS, Python, Django Python, SQL Python, sql"
526,Westley Battrick,wbattrickel@jugem.jp,Male,"Rails, Web MS Excel, Database, Data Analyst, Test CAse Execusion, Python"
527,Ambur Shakeshaft,ashakeshaftem@usnews.com,Female,"Spring NodeJS, C, NodeJS, Data Analyst, NodeJS Python, Programmining Using Visual Basic Language"
528,Marcos Govinlock,mgovinlocken@so-net.ne.jp,Male,"Data Analyst, Python, Agile, HTML5, Networking Python, Data Analyst Business"
529,Livvyy Wing,lwingeo@mediafire.com,Female,"Management Business, Github (GitBash), Data Analyst, Data Analyst Business, Visual Basic 6, Database"
530,Vince Djorevic,vdjorevicep@youku.com,Male,"C#, Android 2D AutoCAD, JavaScript, Database Business, Python, Scala DevOps"
531,Tiffany MacAllen,tmacalleneq@scientificamerican.com,Female,"Data Analyst, C# .NET 4.0, Forecasts English, English, NodeJS Python, Agile Business"
532,Lemar Felix,lfelixer@pagesperso-orange.fr,Male,"Python, SQL, Project, Golang Java, Database, Data Analyst Business"
533,Veradis Field,vfieldes@shareasale.com,Female,"Data Analyst, AWS, Linux, Data Analyst, SQL, Java IDE-Eclipse Operating Systems Windows"
534,Mattheus Tibols,mtibolset@meetup.com,Male,"Database, HTML5, Data Analyst, Python, Python, Database"
535,Sylvan Rodenhurst,srodenhursteu@narod.ru,Male,"people management, Data Analyst Business, Programmining Using Visual Basic Language, Golang Team, HTML5, ireport"
536,Shina Saben,ssabenev@europa.eu,Female,"Data Analyst, Agile Business, QA, Designing And Devevoping Websites By Writing Html, PostgreSql, Asp Programming With Access Db"
537,Clair Euston,ceustonew@guardian.co.uk,Non-binary,"QA, ASP.NET, SQL Data, LabView, QA, Database"
538,Sampson Josse,sjosseex@histats.com,Male,"English Database, Python2, Database, MS TFS, Python, Data Science"
539,Dina Meekings,dmeekingsey@bandcamp.com,Female,"word, QA Business, ireport, Java, Python, JavaScript"
540,Roda Derwin,rderwinez@paypal.com,Female,"Rails Ruby, Data Analyst, Data Analyst, Java, Css, Java"
541,Dusty Farquarson,dfarquarsonf0@prnewswire.com,Genderfluid,"Data Analyst, Database, Golang Python, PostgreSql NodeJS, QA, English Business"
542,Marietta Woodford,mwoodfordf1@jimdo.com,Female,"Database, Python, Database, Data Analyst, Management, Laravel"
543,Erinn Dollen,edollenf2@ebay.co.uk,Agender,"Management Business, SQL, Test Plan Development, Test Strategy Development, powerpoint, UIUX, Business"
544,Suzette Bray,sbrayf3@tamu.edu,Female,"Java, Golang Team, QA Business, on, AWS, Leader SQL"
545,Shauna Boyde,sboydef4@mysql.com,Female,"JavaScript, C# .NET 4.0, Blockchain, on, Asp .NET oracle, LabView"
546,Ax Faichney,afaichneyf5@taobao.com,Male,"SQL, Electric Machinery, Data Analyst, Database, Golang Team, Data Analyst"
547,Lyda Bleackley,lbleackleyf6@xing.com,Female,"Python, Electric Machinery, Agile, QC Business, Python, qlickview Microsof Office"
548,Dewey Wedlake,dwedlakef7@alexa.com,Male,"SQL Business, Leader, Electric Machinery, Data, SQL, Cloud Database"
549,Vinny Anglish,vanglishf8@paginegialle.it,Female,"Java, QC Business, Database Business, on, Microsoft Excel, SQL Business"
550,Derick Hardstaff,dhardstafff9@ehow.com,Male,"Web MS Excel, English Business, Python3, Golang Java, NodeJS, MySQL"
551,Webb Fancourt,wfancourtfa@blogs.com,Male,"Database, Django Python, Linux, Project, SQL Database, on"
552,Vite Jossum,vjossumfb@kickstarter.com,Male,"Sql Server 2008, Sql Server Photoshop, English, Test Strategy Development, Javascript, Python2"
553,Son Brookwell,sbrookwellfc@dedecms.com,Male,"MySQL, UIUX, Business, Python, AWS PHP, NoSQL NodeJS, Visual Basic 6"
554,Elsie Forestall,eforestallfd@fda.gov,Female,"MySQL, Engineering Database, SQL, Test Plan Development, Forecasts English, Data"
555,Susana Orrell,sorrellfe@blinklist.com,Female,"Database, MySQL, MySQL Database, Management, Scala Python, Analytics"
556,Leanor Salasar,lsalasarff@about.me,Female,"Data Analyst, ASP.NET Tester, Scala Python, Python, Cloud PHP, English C++"
557,Devonne Vakhrushev,dvakhrushevfg@quantcast.com,Female,"Cloud PHP, Python, SQL, Rails, Product, Linux"
558,Car Kinloch,ckinlochfh@surveymonkey.com,Male,"Data Analyst, Java, Ruby, Database, Programming in-Python, System"
559,Verena Dunphy,vdunphyfi@ed.gov,Female,"Python, JavaScript, Python2, JavaScript NodeJS, NodeJS, English Database"
560,Latrena Logesdale,llogesdalefj@sun.com,Female,"Css, DotNet Development It Support, CSS Data, Xampp, AWS Java, Data"
561,Cherianne Boxall,cboxallfk@posterous.com,Female,"Golang Java, Database, NodeJS, NodeJS, PHP, Python"
562,Conn Gilvear,cgilvearfl@ning.com,Polygender,"Data Analyst, Data Analyst, NodeJS, Database, Web MS Excel"
563,Magda Vamplew,mvamplewfm@wp.com,Bigender,"Financial Managment SQL, Data Analyst, AWS, Management, C# .NET 4.0, English Data"
564,Johna Ainscough,jainscoughfn@qq.com,Female,"Business, Python, Python, Data Analyst, Html/Webpage Designing, English"
565,Liam Lenin,lleninfo@virginia.edu,Male,"MATLAB, JavaScript, Flask, Python, English, Rails"
566,Owen Cardillo,ocardillofp@oaic.gov.au,Male,"Programming in-Python, Database Business, Pycharm, Crystal Reports, Data Science, NodeJS"
567,Rodger Michiel,rmichielfq@time.com,Male,"Honours Degree Psychology, MySQL, qlickview Microsof Office, Data Analyst, English Business, System"
568,Jarad Ketteman,jkettemanfr@rediff.com,Male,"Rails, Ruby, SQL Python, AWS Ruby, UIUX, Business, MySQL"
569,Magdaia Grierson,mgriersonfs@youtu.be,Female,"Asp .NET oracle, powerpoint, Python, Linux, word, Python"
570,Fawn Plomer,fplomerft@wikia.com,Female,"MySQL, PostgreSqlPsychology Degree, Business, CSS Data, Data Analyst, Golang Java"
571,Pris Husband,phusbandfu@ameblo.jp,Female,"Remote Executing Commands On Systems, Crystal Reports, Javascript, JavaScript NodeJS, Dhtml, Java"
572,Jerrine Tole,jtolefv@unblog.fr,Female,"sql, Management Business, Electric Machinery, Cloud Cloud, Android 2D AutoCAD, Financial Managment SQL"
573,Rebecca Cereceres,rcereceresfw@fda.gov,Female,"Leader, Golang Java, English Business, Database Business, JavaScript PHP, Visual Basic 6"
574,Emmaline Sporgeon,esporgeonfx@foxnews.com,Female,"Css, SQL, Agile, MS Exchange Server, powerbi, Financial Managment SQL"
575,Guntar Castellucci,gcastelluccify@walmart.com,Male,"SQL Tester, Management Business, Golang Java, MS Exchange Server, Programming in-Python, SQL Business"
576,Zonnya Strudwick,zstrudwickfz@domainmarket.com,Female,"Management, C#, Jquery, AWS Java, Python2, SQL"
577,Pyotr Weedall,pweedallg0@people.com.cn,Male,"Microsoft Support, Python2, Team, Python, Python3, Designing And Devevoping Websites By Writing Html"
578,Helaina Orpin,horping1@marketwatch.com,Female,"Ubuntu, NoSQL NodeJS, UIUX, Business, Data Analyst, English Business, Blockchain"
579,Risa Marini,rmarinig2@youtu.be,Female,"Python, Business, Blockchain, QC Business, Team, Database"
580,Lucais Iorio,lioriog3@answers.com,Male,"powerpoint, Network Management, Golang Java, UIUX, Business, .NET PHP, QC Business"
581,Ethelind Arnault,earnaultg4@economist.com,Female,"Data Analyst, Data Analyst, Blockchain, HTML, Test Results Analysis Microsoft Access With Sql, project management"
582,Desiree Ivy,divyg5@reuters.com,Female,"QC Python, LTSPICE-intermediate Languages and and MIPOWER-intermediate, QA, English Business, Python, English"
583,Ajay Larwell,alarwellg6@ucoz.com,Female,"MySQL Database, Data Analyst, .NET PHP, General IT Management, Agile, SQL"
584,Fidole Cripps,fcrippsg7@bigcartel.com,Genderfluid,"MySQL Database, C++, JavaScript, Data, Python2, NoSQL NodeJS"
